[{"id":296021261,"resource_state":2,"external_id":"garmin_push_761955908","upload_id":334864352,"athlete":{"id":6565991,"resource_state":1},"name":"05/01/2015 Finland","distance":78061.3,"moving_time":15769,"elapsed_time":17626,"total_elevation_gain":2167,"type":"Ride","start_date":"2015-05-01T07:09:59Z","start_date_local":"2015-05-01T10:09:59Z","timezone":"(GMT+02:00) Europe/Helsinki","start_latlng":[61.47,23.73],"end_latlng":[61.47,23.73],"location_city":null,"location_state":null,"location_country":"Finland","start_latitude":61.47,"start_longitude":23.73,"achievement_count":1,"kudos_count":0,"comment_count":0,"athlete_count":2,"photo_count":0,"map":{"id":"a296021261","summary_polyline":"geevJiiyoClI_mCiXkpAm_ApF_\\ot@{FeA}@ne@wErBvDt_BiTxFa@pb@yHbZeP`P@|l@k_@~hAuKlbAoO~sBp@bsBaJtKeU`eAup@n}AyIbc@oQnPoLro@_Szf@wYrVaOtg@aWfb@bH`IiPzh@~PkLhCdYsRne@qTzaBnPtHqFxz@nAdt@_d@nt@fDhBrNaUvBfNoI|QkO`B_A{PsSvl@{DiEiJ|o@pE_BgXztAdApVmHzr@nDhK}CDtJkGmSvu@sG}O{DrS`Khc@aRlShIfFoCx`@s[x}@dEkdBoHkf@e`@pn@cB~U`GpKvFrx@w@rTeM~PnDnm@iWff@u@bm@{O_PmJhm@~@rg@eEZiF|sAcWxv@tQxJ}Gza@lCnc@sQhpAqK{Dw@yRjKsc@iDqc@rHq^kIm@b@}HvHcTpZnK`J}K`VgrAzWsh@}FsWrD{A~CchApIoY}@gZ_h@qVd@aa@aFyXxG}FdC}n@rSw}@bDak@p[g}@`Ikn@~G`IdAiRpMhOnDev@nPqUjCeYbKgJtT{_Bb]kZlQe`@fHox@vJoZhFqFzNjZzXmNzQ|X~Vk_@p[uRfEr`AkOxZxSb}Az_@pTxDaLbKx@dN~Xx^iVzKnHlUww@lVcIhOfRpEa^yb@uaDwMgHeEmgBzCoHtQqR`r@uLxB~ItJmC^jQxGzKxVlDx@tKz\\qErw@{z@SgIpOsU`Gia@uGwzAdDazD{WaiGpCqmB}GiaB","resource_state":2},"trainer":false,"commute":false,"manual":false,"private":false,"flagged":false,"gear_id":null,"average_speed":4.95,"max_speed":14.2,"average_temp":9,"average_watts":95.9,"kilojoules":1511.8,"device_watts":false,"average_heartrate":139.6,"max_heartrate":181,"truncated":null,"has_kudoed":false},{"id":295420844,"resource_state":2,"external_id":"garmin_push_761126285","upload_id":334171841,"athlete":{"id":6565991,"resource_state":1},"name":"04/30/2015 Finland","distance":21128.1,"moving_time":3947,"elapsed_time":5395,"total_elevation_gain":253,"type":"Ride","start_date":"2015-04-30T14:10:45Z","start_date_local":"2015-04-30T17:10:45Z","timezone":"(GMT+02:00) Europe/Helsinki","start_latlng":[61.47,23.76],"end_latlng":[61.47,23.73],"location_city":null,"location_state":null,"location_country":"Finland","start_latitude":61.47,"start_longitude":23.76,"achievement_count":0,"kudos_count":0,"comment_count":0,"athlete_count":1,"photo_count":0,"map":{"id":"a295420844","summary_polyline":"ybdvJma_pC~BxIuA`GeWjYoCpcBqAzCcDl^nBzApSaJlEPrDaE`BsH[am@jIg@r@k\\rObAzB{GnCGlIkNjFhEgEaYdDkOdFcF~BiUzBmu@kAsh@l@iZaAgOqO{V{Fib@qR{OkF{[_Ci@fCzDxAkBq@gJz@qTuCuH`@yS`AwE~GoJy@mJnHg^aAwMbHuL|@sURyq@_EoECqVkFyf@cPfJoEfM~CxVxLna@lKCdDjHk@`o@mGnKYnN_HvPaG`AoEnN`BdHnJ}EbB`BEdCsIzOs@zSpCxHq@pWj@xHuAjEhGla@xAh@~A_GbK`I|Fhb@pNrT|AvJ_@ra@hArl@{Bxp@{BlVkDfDg@lRuC_Eq@bCnEpY{FoEeH|FSvFiCWaCrHyO}@k@z[mIRTfl@eItFaC~GwP@MrMgBEPuC","resource_state":2},"trainer":false,"commute":false,"manual":false,"private":false,"flagged":false,"gear_id":null,"average_speed":5.353,"max_speed":12.1,"average_temp":7,"average_watts":116.4,"kilojoules":459.4,"device_watts":false,"average_heartrate":143.3,"max_heartrate":179,"truncated":null,"has_kudoed":false},{"id":295420782,"resource_state":2,"external_id":"garmin_push_761126213","upload_id":334171796,"athlete":{"id":6565991,"resource_state":1},"name":"04/30/2015 Finland","distance":16183.1,"moving_time":3315,"elapsed_time":3916,"total_elevation_gain":169,"type":"Ride","start_date":"2015-04-30T04:41:33Z","start_date_local":"2015-04-30T07:41:33Z","timezone":"(GMT+02:00) Europe/Helsinki","start_latlng":[61.47,23.73],"end_latlng":[61.47,23.76],"location_city":null,"location_state":null,"location_country":"Finland","start_latitude":61.47,"start_longitude":23.73,"achievement_count":0,"kudos_count":0,"comment_count":0,"athlete_count":1,"photo_count":0,"map":{"id":"a295420782","summary_polyline":"ubevJweyoCvCi}@OhTgAjBuDb^|BlB~@qa@~@sDhAad@]{VjBue@`DqAxU{YyDeQ","resource_state":2},"trainer":false,"commute":false,"manual":false,"private":false,"flagged":false,"gear_id":null,"average_speed":4.882,"max_speed":8.4,"average_temp":0,"average_watts":43.3,"kilojoules":143.6,"device_watts":false,"average_heartrate":134.5,"max_heartrate":157,"truncated":null,"has_kudoed":false},{"id":294897167,"resource_state":2,"external_id":"garmin_push_760392333","upload_id":333566769,"athlete":{"id":6565991,"resource_state":1},"name":"04/29/2015 Finland","distance":21950.9,"moving_time":3097,"elapsed_time":3192,"total_elevation_gain":146,"type":"Ride","start_date":"2015-04-29T15:35:17Z","start_date_local":"2015-04-29T18:35:17Z","timezone":"(GMT+02:00) Europe/Helsinki","start_latlng":[61.5,23.76],"end_latlng":[61.47,23.73],"location_city":null,"location_state":null,"location_country":"Finland","start_latitude":61.5,"start_longitude":23.76,"achievement_count":2,"kudos_count":0,"comment_count":0,"athlete_count":1,"photo_count":0,"map":{"id":"a294897167","summary_polyline":"ijjvJca_pCvCx{@sBnt@}CvYApg@eBtJgPna@}Mhj@_H~t@{@ze@kFjr@mFl]Kt}@hFteAqAbO~Kv~@pDnExGj_AiCbf@_EjMfAvKh@|aC|Ank@p@puAdM{TvHyEn]VbGoAjKuJnKz`AnQff@lHwNhBsUvBcHza@{G|NiJnf@ko@W}HlLcPjDeMj@oLfCyJuCwO}AeXi@wq@vDe_AmAsj@x@mnA}K}aBp@c}@sLyjBtCcgB_@eUyAwBh@yZwA{K[i]iB[RkC","resource_state":2},"trainer":false,"commute":false,"manual":false,"private":false,"flagged":false,"gear_id":null,"average_speed":7.088,"max_speed":12.2,"average_temp":0,"average_watts":124.9,"kilojoules":386.8,"device_watts":false,"average_heartrate":128,"max_heartrate":169,"truncated":null,"has_kudoed":false},{"id":294897148,"resource_state":2,"external_id":"garmin_push_760392265","upload_id":333566728,"athlete":{"id":6565991,"resource_state":1},"name":"04/29/2015 Finland","distance":21287.7,"moving_time":3488,"elapsed_time":3505,"total_elevation_gain":190,"type":"Ride","start_date":"2015-04-29T04:41:49Z","start_date_local":"2015-04-29T07:41:49Z","timezone":"(GMT+02:00) Europe/Helsinki","start_latlng":[61.47,23.73],"end_latlng":[61.5,23.76],"location_city":null,"location_state":null,"location_country":"Finland","start_latitude":61.47,"start_longitude":23.73,"achievement_count":1,"kudos_count":0,"comment_count":0,"athlete_count":1,"photo_count":0,"map":{"id":"a294897148","summary_polyline":"}bevJadyoCnBtDtBre@e@`YtAvCVlPCfe@mCveAfLldBc@bbA`LlcB{@nnAdA~m@oDzx@f@~s@bArSjDjT}Glb@_OtT`@lHqm@nu@wj@|LcB~EgBlVqIxNiPoc@{KqbAwKvJsMxAnE{HKoHwBqER}KyAgE~C{HaBm[sGoa@gBuVv@eXtD}QAaKcHuy@yEoU_Igw@aBga@wCoVoDoO}H{PaHoHkHaCaF{dA?qnAtEmV~Eam@rAol@rGir@xO}p@lOwZ|BmNBsg@rEeuAkBcr@iBF","resource_state":2},"trainer":false,"commute":false,"manual":false,"private":false,"flagged":false,"gear_id":null,"average_speed":6.103,"max_speed":9.9,"average_temp":3,"average_watts":104.4,"kilojoules":364.3,"device_watts":false,"average_heartrate":136,"max_heartrate":172,"truncated":null,"has_kudoed":false},{"id":294278500,"resource_state":2,"external_id":"garmin_push_759525219","upload_id":332850799,"athlete":{"id":6565991,"resource_state":1},"name":"04/28/2015 Finland","distance":16486.8,"moving_time":3182,"elapsed_time":3993,"total_elevation_gain":190,"type":"Ride","start_date":"2015-04-28T16:33:29Z","start_date_local":"2015-04-28T19:33:29Z","timezone":"(GMT+02:00) Europe/Helsinki","start_latlng":[61.47,23.76],"end_latlng":[61.47,23.73],"location_city":null,"location_state":null,"location_country":"Finland","start_latitude":61.47,"start_longitude":23.76,"achievement_count":0,"kudos_count":0,"comment_count":0,"athlete_count":1,"photo_count":0,"map":{"id":"a294278500","summary_polyline":"ubdvJob_pCnDpNvIyEpCpHVvFtBV|L`^j@nJhIaGpInHrMwHpP~AjIwBzBoD\\jElCiGnC{AfLrZvDtApCnMnCpBHlUvTqLxHyH^eFpBoAoAdN{_@|Tch@{AaIbC~AvInJlI`IVMxFfH~r@lCi@l@rHpHlG`@nEtAElI|L~ChTuJtT{H]BjGiBlHxBx\\wCpIu@`Jb@hKkClToDpJvEd^_DbAyDvHuD|T^tMkEvZiAGwBeHsAiV}FdEyCnO_Bq@yD}NiCc@aKtEuAnIoGfIqG{NaVgUsGeCmMzCkB`FuJzDeKi}AvCkqAc@uh@sAuB`@w[oBq]yHuFzAqJ`C`A","resource_state":2},"trainer":false,"commute":false,"manual":false,"private":false,"flagged":false,"gear_id":null,"average_speed":5.181,"max_speed":11.8,"average_temp":8,"average_watts":92.9,"kilojoules":295.7,"device_watts":false,"truncated":null,"has_kudoed":false},{"id":294278481,"resource_state":2,"external_id":"garmin_push_759525164","upload_id":332850759,"athlete":{"id":6565991,"resource_state":1},"name":"04/28/2015 Finland","distance":10083.8,"moving_time":1709,"elapsed_time":1709,"total_elevation_gain":79,"type":"Ride","start_date":"2015-04-28T04:29:36Z","start_date_local":"2015-04-28T07:29:36Z","timezone":"(GMT+02:00) Europe/Helsinki","start_latlng":[61.47,23.73],"end_latlng":[61.47,23.76],"location_city":null,"location_state":null,"location_country":"Finland","start_latitude":61.47,"start_longitude":23.73,"achievement_count":1,"kudos_count":0,"comment_count":0,"athlete_count":1,"photo_count":0,"map":{"id":"a294278481","summary_polyline":"_eevJoeyoCm@uFnFo_@xAug@R_dA_E}ToMy_@_F_^mKyTjCiTjDaKf@e\\hAsEfFoBrJxBhCsi@~B{E`K}e@hOeU|KcAdGfXInCzLlMpDbAtF~a@`P`Xz@lNo@pZjAr^UhXmEf|@sDjDg@xRsCiDaA`C\\lGvDbLMdDsE}EgEnFeCNi@}JwLo]sBc@a@wFaDaIqIrF_EqR","resource_state":2},"trainer":false,"commute":false,"manual":false,"private":false,"flagged":false,"gear_id":null,"average_speed":5.9,"max_speed":12,"average_temp":6,"average_watts":95,"kilojoules":162.4,"device_watts":false,"truncated":null,"has_kudoed":false},{"id":294278453,"resource_state":2,"external_id":"garmin_push_759525114","upload_id":332850733,"athlete":{"id":6565991,"resource_state":1},"name":"04/27/2015 Finland","distance":10146.1,"moving_time":1828,"elapsed_time":1828,"total_elevation_gain":78,"type":"Ride","start_date":"2015-04-27T14:02:36Z","start_date_local":"2015-04-27T17:02:36Z","timezone":"(GMT+02:00) Europe/Helsinki","start_latlng":[61.47,23.76],"end_latlng":[61.47,23.73],"location_city":null,"location_state":null,"location_country":"Finland","start_latitude":61.47,"start_longitude":23.76,"achievement_count":0,"kudos_count":0,"comment_count":0,"athlete_count":1,"photo_count":0,"map":{"id":"a294278453","summary_polyline":"scdvJ}`_pCeXn_BuAzzAmBGNsC","resource_state":2},"trainer":false,"commute":false,"manual":false,"private":false,"flagged":false,"gear_id":null,"average_speed":5.55,"max_speed":9.3,"average_temp":9,"average_watts":52.2,"kilojoules":95.5,"device_watts":false,"truncated":null,"has_kudoed":false},{"id":294278437,"resource_state":2,"external_id":"garmin_push_759525072","upload_id":332850693,"athlete":{"id":6565991,"resource_state":1},"name":"04/27/2015 Finland","distance":3788.4,"moving_time":644,"elapsed_time":660,"total_elevation_gain":19,"type":"Ride","start_date":"2015-04-27T04:36:04Z","start_date_local":"2015-04-27T07:36:04Z","timezone":"(GMT+02:00) Europe/Helsinki","start_latlng":[61.47,23.73],"end_latlng":[61.47,23.76],"location_city":null,"location_state":null,"location_country":"Finland","start_latitude":61.47,"start_longitude":23.73,"achievement_count":0,"kudos_count":0,"comment_count":0,"athlete_count":1,"photo_count":0,"map":{"id":"a294278437","summary_polyline":"k`evJaiyoC}DmAfGsc@vAshBaEmVaHaQqGih@bOdBzWxQrGvFnKnRkGtGeEkP","resource_state":2},"trainer":false,"commute":false,"manual":false,"private":false,"flagged":false,"gear_id":null,"average_speed":5.883,"max_speed":8.6,"average_temp":10,"average_watts":81,"kilojoules":52.1,"device_watts":false,"truncated":null,"has_kudoed":false},{"id":289260935,"resource_state":2,"external_id":"garmin_push_752185009","upload_id":326997883,"athlete":{"id":6565991,"resource_state":1},"name":"04/20/2015 Finland","distance":25806.9,"moving_time":5454,"elapsed_time":5810,"total_elevation_gain":376,"type":"Ride","start_date":"2015-04-20T14:44:39Z","start_date_local":"2015-04-20T17:44:39Z","timezone":"(GMT+02:00) Europe/Helsinki","start_latlng":[61.47,23.76],"end_latlng":[61.47,23.73],"location_city":null,"location_state":null,"location_country":"Finland","start_latitude":61.47,"start_longitude":23.76,"achievement_count":2,"kudos_count":0,"comment_count":0,"athlete_count":1,"photo_count":0,"map":{"id":"a289260935","summary_polyline":"wcdvJec_pC|ExOhIqFlDpOtBl@jFfN~EtPf@tHxHqGtE~ETiCcEuM[oGjD{NrGaJlEy}@aA{r@l@yZgAyN}NwTiGyc@uRyO}Ei[}DgCzEwBbA}WoCuG`@oTbJeQ{@mJrHo]iA_NnHoMt@sSXih@qAoKyBwCHmSoFyi@}C~AqCv]gBdDeFdBzGp\\m@hG`E~Mk@xP`DlGMzDxD|JiBbMnAXRxJcHpSiGpAeEjKtA~J|JoEzA`EoNfV_B`SeBeAgByGe@fJpHlJtB`I@rH~A]`AqUwCwIf@aT`J_Qy@uJlH{]_A}MjHuMhAe}@mAiKyBaCLoUwF{g@aPjJiEvL|CfWxFxUo@zFxDpMe@pQrBtC^~GzClGLpJwAnEhAT~@pNaHl^j@bK{I`Qs@|SnClHWnO_@dGyEtDpDjAhGx\\fL~LdDv@zGxd@`OnVpAnpAqBvw@}BbUkFpEqD`PxEtXkG{DyFjGw@QY}IaFmO{FaOeBM[aFeDqIyHrGmEyPzDlQyZ`]eBre@cArwAcDD_AxFzBfB","resource_state":2},"trainer":false,"commute":false,"manual":false,"private":false,"flagged":false,"gear_id":null,"average_speed":4.732,"max_speed":10,"average_temp":7,"average_watts":107,"kilojoules":583.5,"device_watts":false,"average_heartrate":148.6,"max_heartrate":183,"truncated":null,"has_kudoed":false},{"id":289260882,"resource_state":2,"external_id":"garmin_push_752184939","upload_id":326997806,"athlete":{"id":6565991,"resource_state":1},"name":"04/20/2015 Finland","distance":19063.5,"moving_time":3128,"elapsed_time":3414,"total_elevation_gain":203,"type":"Ride","start_date":"2015-04-20T04:40:16Z","start_date_local":"2015-04-20T07:40:16Z","timezone":"(GMT+02:00) Europe/Helsinki","start_latlng":[61.47,23.73],"end_latlng":[61.47,23.76],"location_city":null,"location_state":null,"location_country":"Finland","start_latitude":61.47,"start_longitude":23.73,"achievement_count":0,"kudos_count":0,"comment_count":0,"athlete_count":1,"photo_count":0,"map":{"id":"a289260882","summary_polyline":"ecevJ_gyoCxBx@LcMjVRrDqDjBmH_@sn@tI_@f@q[vO`ApCuH|BF@wEjC_@xDiFrFtDwEqX~CiOxF_GvBcT~Bev@kAgh@l@y[}@{L_OcVoGsc@mR_PmFc\\wDaBnEuCbAmQK_G{BwE\\iTvImQm@aJdH_^}@cNbHoM|@mSb@}h@sAiKwBsBDgUsFih@_PpIcDjKgFdCkIt]]bX`Ab\\~Fba@{Ox]cD|TaWqEAr]dE|y@qAjN_Lba@}@nn@{E|kAf@jB{A`PfKlS`Fh_@tLj]tE`W{AjjBmAvCqCp^`Ax@gAmDlF_a@nC_cB|DuBjUsYeEmP","resource_state":2},"trainer":false,"commute":false,"manual":false,"private":false,"flagged":false,"gear_id":null,"average_speed":6.094,"max_speed":10.9,"average_temp":1,"average_watts":124.9,"kilojoules":390.8,"device_watts":false,"average_heartrate":151.1,"max_heartrate":180,"truncated":null,"has_kudoed":false},{"id":287652375,"resource_state":2,"external_id":"garmin_push_749610810","upload_id":325107602,"athlete":{"id":6565991,"resource_state":1},"name":"04/18/2015 Finland","distance":65575.5,"moving_time":12170,"elapsed_time":15912,"total_elevation_gain":823,"type":"Ride","start_date":"2015-04-18T07:48:18Z","start_date_local":"2015-04-18T10:48:18Z","timezone":"(GMT+02:00) Europe/Helsinki","start_latlng":[61.55,23.57],"end_latlng":[61.47,23.73],"location_city":null,"location_state":null,"location_country":"Finland","start_latitude":61.55,"start_longitude":23.57,"achievement_count":4,"kudos_count":0,"comment_count":0,"athlete_count":3,"photo_count":0,"map":{"id":"a287652375","summary_polyline":"g`tvJgzynCqApqBcN~d@sTdGgV~vAwH|GeIcNoGrh@fA~ZdE{@s@vWsIj~@}OtHiMuJ`@lr@dH|XjF_CwDmb@~JvBxP{e@dG_d@{@_Znb@a_Cdi@wdAlEw{AlGbNqHhz@bMaFfDmpBoPuHdNosAqBws@`Dm]tEpUhMaQHi\\|M}b@_DoLpL{t@lbAoGxKbf@rK_LvAvJlJvAbE{QlK_DzEtJk@aaA`Rw@iE}f@bGy{@_PySXmOoHcT}LfZ@sLli@gsBjPkSn\\n|B{F`Z}K~HnC`t@rc@lk@|FtyAlLxXhH~@hB`[uO|GrKnHkDb\\nHlCuAyZvEmI{RlCt@vZ}MDgGz]zGItGrj@~SyDkCvs@|CjKoMja@kLfItDj]_Xp]lGfeA{FvRrCfXdViMnL~PdFeBpBjuAaGzWgOnRzSDwDxa@kHjKl@uLjNO`DfKt@aNyJhFaDf\\hNfGhClRu_@hc@eTgJ_OnRuFzc@_PtOdVj{@xHzu@vLrYtHdMnNu`@dL}Gm@wIkEpHoJqi@xB{r@}I{a@Mie@lUi^pHy_@w@eT`Twk@cIsz@cNgWZ{~Aua@gsCmMoGeEigBrVc\\lr@kLdBbJxJuC`@nQ|HnLzU~Cl@dKn^yEvv@g{@[{HnQa\\~DmZwGqzAdDczDyWkhGjC{mBwGabB","resource_state":2},"trainer":false,"commute":false,"manual":false,"private":false,"flagged":false,"gear_id":null,"average_speed":5.388,"max_speed":13.5,"average_temp":0,"average_watts":106.9,"kilojoules":1300.8,"device_watts":false,"average_heartrate":150,"max_heartrate":189,"truncated":null,"has_kudoed":false},{"id":287652236,"resource_state":2,"external_id":"garmin_push_749610684","upload_id":325107469,"athlete":{"id":6565991,"resource_state":1},"name":"04/18/2015 Finland","distance":22513.8,"moving_time":3983,"elapsed_time":5253,"total_elevation_gain":345,"type":"Ride","start_date":"2015-04-18T06:11:02Z","start_date_local":"2015-04-18T09:11:02Z","timezone":"(GMT+02:00) Europe/Helsinki","start_latlng":[61.47,23.73],"end_latlng":[61.55,23.56],"location_city":null,"location_state":null,"location_country":"Finland","start_latitude":61.47,"start_longitude":23.73,"achievement_count":1,"kudos_count":0,"comment_count":0,"athlete_count":3,"photo_count":0,"map":{"id":"a287652236","summary_polyline":"udevJ{syoCrEk\\dBm`BmBmSkPyh@aDgXy}@dHqFcFiL{b@iIoJqEc@b@bPgBhT}EtAfDdt@Tlk@}StEk@`d@oHhYyNlKe@bo@qBhMwN~XsP|q@uG~s@wAxl@{E|l@{EtXWns@xAj}@cJrKsUffAgUjc@qJn`@eObX}H`VOlKyEx@SvDaJvHwDdXJdPiIlS~CgGbGcBdGwYqHlCs@sB~F}QUuEaDrBmDjK`@dAasBnuIiBp]`PjGoB`a@yD|Cy@bMyBfFqG{m@ByHyBeA_EzQaDeB","resource_state":2},"trainer":false,"commute":false,"manual":false,"private":false,"flagged":false,"gear_id":null,"average_speed":5.652,"max_speed":14.8,"average_temp":0,"average_watts":107,"kilojoules":426.2,"device_watts":false,"average_heartrate":152.5,"max_heartrate":183,"truncated":null,"has_kudoed":false},{"id":287652205,"resource_state":2,"external_id":"garmin_push_749610640","upload_id":325107431,"athlete":{"id":6565991,"resource_state":1},"name":"04/17/2015 Finland","distance":17115.2,"moving_time":3249,"elapsed_time":3327,"total_elevation_gain":185,"type":"Ride","start_date":"2015-04-17T04:39:08Z","start_date_local":"2015-04-17T07:39:08Z","timezone":"(GMT+02:00) Europe/Helsinki","start_latlng":[61.47,23.73],"end_latlng":[61.47,23.73],"location_city":null,"location_state":null,"location_country":"Finland","start_latitude":61.47,"start_longitude":23.73,"achievement_count":0,"kudos_count":0,"comment_count":0,"athlete_count":1,"photo_count":0,"map":{"id":"a287652205","summary_polyline":"yaevJefyoCbBEv@qMrTfAxDaEfBcHc@sn@nISn@_\\tObAxB}GpCGAoFtCStCuEjGdDyEyWhD{OpFoF~BkTvBct@gAwj@j@g[aAcN}NuUoGyc@qRuOeFm[wDsBlEaCfAuREmFaCuEb@aUxI{Pw@eJhHq]{@sN`H{Lx@uSTms@aEaEJeVuFgg@}O`JcDfKoFrC_Id\\g@rTjAnb@~Fn_@aP|]kDbUaWuEJj^zDjz@iA|L{HrT_C|Pm@|j@uEtiAj@fB{A|OzJzSpFj`@bLl\\vEpU`@fOqB~zAwFbb@tBzA","resource_state":2},"trainer":false,"commute":false,"manual":false,"private":false,"flagged":false,"gear_id":null,"average_speed":5.268,"max_speed":11.7,"average_temp":1,"average_watts":99.2,"kilojoules":322.2,"device_watts":false,"truncated":null,"has_kudoed":false},{"id":287652166,"resource_state":2,"external_id":"garmin_push_749610583","upload_id":325107393,"athlete":{"id":6565991,"resource_state":1},"name":"04/16/2015 Finland","distance":2021.6,"moving_time":381,"elapsed_time":417,"total_elevation_gain":11,"type":"Ride","start_date":"2015-04-16T14:23:27Z","start_date_local":"2015-04-16T17:23:27Z","timezone":"(GMT+02:00) Europe/Helsinki","start_latlng":[61.47,23.76],"end_latlng":[61.47,23.73],"location_city":null,"location_state":null,"location_country":"Finland","start_latitude":61.47,"start_longitude":23.76,"achievement_count":0,"kudos_count":0,"comment_count":0,"athlete_count":1,"photo_count":0,"map":{"id":"a287652166","summary_polyline":"wcdvJw__pCzDjH_@jD{Y|[sBr}A}Gnh@`CbA","resource_state":2},"trainer":false,"commute":false,"manual":false,"private":false,"flagged":false,"gear_id":null,"average_speed":5.306,"max_speed":7.3,"average_temp":8,"average_watts":78.1,"kilojoules":29.8,"device_watts":false,"truncated":null,"has_kudoed":false},{"id":287652154,"resource_state":2,"external_id":"garmin_push_749610537","upload_id":325107374,"athlete":{"id":6565991,"resource_state":1},"name":"04/16/2015 Finland","distance":19081.2,"moving_time":3573,"elapsed_time":3730,"total_elevation_gain":196,"type":"Ride","start_date":"2015-04-16T04:46:03Z","start_date_local":"2015-04-16T07:46:03Z","timezone":"(GMT+02:00) Europe/Helsinki","start_latlng":[61.47,23.73],"end_latlng":[61.47,23.76],"location_city":null,"location_state":null,"location_country":"Finland","start_latitude":61.47,"start_longitude":23.73,"achievement_count":0,"kudos_count":0,"comment_count":0,"athlete_count":1,"photo_count":0,"map":{"id":"a287652154","summary_polyline":"_bevJaiyoCrBr@LyKvT`A~DcE|AeHUkn@jIQp@a\\bPr@|BcHlCG@aFhCI~DuFdFhEsEwXbDmOpFuF~BuS~Bst@kAuj@j@c]aA}L}NoUoGuc@kRqOcFa[}D}BnEeCb@mFd@_PqC_If@}SpIoPg@{JhHk^}@oMxGwLhAeT\\sh@wAqKyB}BHiUuFih@wOxIuCpJoFrCmIx\\i@~Vv@xZfGde@oO|\\gD`UgW_DJb_@vDxx@gArLsIhVsA`Jy@bm@aF`mAn@lBcBrOzMrUhDt[vLf^rEjV`@rOcB~Ym@p_AaG~b@b@dBc@eBrDu^jAkBpC}cBjD_BvU{Y}D_Q","resource_state":2},"trainer":false,"commute":false,"manual":false,"private":false,"flagged":false,"gear_id":null,"average_speed":5.34,"max_speed":10.9,"average_temp":0,"average_watts":99.5,"kilojoules":355.6,"device_watts":false,"truncated":null,"has_kudoed":false},{"id":286089321,"resource_state":2,"external_id":"garmin_push_747417775","upload_id":323315402,"athlete":{"id":6565991,"resource_state":1},"name":"04/15/2015 Finland","distance":55251.7,"moving_time":10299,"elapsed_time":12588,"total_elevation_gain":583,"type":"Ride","start_date":"2015-04-15T14:33:24Z","start_date_local":"2015-04-15T17:33:24Z","timezone":"(GMT+02:00) Europe/Helsinki","start_latlng":[61.47,23.73],"end_latlng":[61.47,23.73],"location_city":null,"location_state":null,"location_country":"Finland","start_latitude":61.47,"start_longitude":23.73,"achievement_count":0,"kudos_count":0,"comment_count":0,"athlete_count":1,"photo_count":0,"map":{"id":"a286089321","summary_polyline":"y_evJq|xoCvEbkB{CzuAtKv_BYzdAbLtdBLrxBsDt_Ad@nq@nF|h@mG~a@wJ`B}Bt[sh@tq@eVjJiD|l@qNz`AhBn[iCrLvCjr@}Abe@|RzsByB`w@aUlCrCtJ{IxGoY_BsFxIiJ}iA}JkNkDhf@aR`XaBhi@bBfJlC}FzHgh@fDaChBdJeBzFjChJmFpGwCv\\zNbHkE``@zWiWxKhw@jElDkBbXpb@~X_EfDkCfx@uEnU`St]uBx^rL`AzAvGgDbi@rNvC|Enh@fEAjDdI{PWqMrMMkg@aE_OjBcNsDoFmCdIrCsIpD~EgBlOxDfNHtd@~I}tAmCuP`EmTy@{HfDeBSiScEwLdDoLeIc[nDwLmFgH}E_Z}D~@{CsK{^_RlCoXgIaEcCkLp@sp@_FJuHhPkO`LfGe^kPuIxCwNiA}f@cBYmEpSW~NeFnGbB{w@|NeQrFqV{B}nArBqg@ob@ezC}MiHcEogBfU_\\`_@CjS}LbC|IhJgCd@|QhGpJdWbE^nKj_@aF|P{Lhd@{l@WeIzO{VvFw_@yDoVaBscArDq`AkAau@hGeDy@kZvc@rN_EgDnXqz@nCmX~PoNnIjN_C|f@}FbUpEhIiAdPhNwZxEq}@yPwq@{RpDwBkf@gNee@ua@g^g]zOwJe|A|Cw`BcEsdBgBoA","resource_state":2},"trainer":false,"commute":false,"manual":false,"private":false,"flagged":false,"gear_id":null,"average_speed":5.365,"max_speed":12.1,"average_temp":2,"average_watts":102.9,"kilojoules":1059.4,"device_watts":false,"truncated":null,"has_kudoed":false},{"id":286089222,"resource_state":2,"external_id":"garmin_push_747417683","upload_id":323315305,"athlete":{"id":6565991,"resource_state":1},"name":"04/15/2015 Finland","distance":5753.4,"moving_time":788,"elapsed_time":849,"total_elevation_gain":659,"type":"Ride","start_date":"2015-04-15T14:00:46Z","start_date_local":"2015-04-15T17:00:46Z","timezone":"(GMT+02:00) Europe/Helsinki","start_latlng":[61.5,23.76],"end_latlng":[61.47,23.73],"location_city":null,"location_state":null,"location_country":"Finland","start_latitude":61.5,"start_longitude":23.76,"achievement_count":0,"kudos_count":0,"comment_count":0,"athlete_count":1,"photo_count":0,"map":{"id":"a286089222","summary_polyline":"mdjvJoa_pCfKmD\\}LtLkChGdKtC{At@wFI}]~AoO]oQrGpBhHrJ~I|]dFlH`_A}GnDjYpM|_@rDpSwAziBgGpb@~BjA","resource_state":2},"trainer":false,"commute":false,"manual":false,"private":false,"flagged":false,"gear_id":null,"average_speed":7.301,"max_speed":10,"average_temp":7,"average_watts":117.3,"kilojoules":92.4,"device_watts":false,"truncated":null,"has_kudoed":false},{"id":286089187,"resource_state":2,"external_id":"garmin_push_747417640","upload_id":323315257,"athlete":{"id":6565991,"resource_state":1},"name":"04/15/2015 Finland","distance":5843.3,"moving_time":898,"elapsed_time":922,"total_elevation_gain":37,"type":"Ride","start_date":"2015-04-15T04:36:33Z","start_date_local":"2015-04-15T07:36:33Z","timezone":"(GMT+02:00) Europe/Helsinki","start_latlng":[61.47,23.73],"end_latlng":[61.5,23.76],"location_city":null,"location_state":null,"location_country":"Finland","start_latitude":61.47,"start_longitude":23.73,"achievement_count":0,"kudos_count":0,"comment_count":0,"athlete_count":1,"photo_count":0,"map":{"id":"a286089187","summary_polyline":"gdevJ_hyoCurCe`EaAzBwPjE","resource_state":2},"trainer":false,"commute":false,"manual":false,"private":false,"flagged":false,"gear_id":null,"average_speed":6.507,"max_speed":6.9,"average_temp":0,"average_watts":90.5,"kilojoules":81.3,"device_watts":false,"truncated":null,"has_kudoed":false},{"id":286089174,"resource_state":2,"external_id":"garmin_push_747417595","upload_id":323315225,"athlete":{"id":6565991,"resource_state":1},"name":"04/14/2015 Finland","distance":18997.8,"moving_time":4186,"elapsed_time":4263,"total_elevation_gain":285,"type":"Ride","start_date":"2015-04-14T15:30:46Z","start_date_local":"2015-04-14T18:30:46Z","timezone":"(GMT+02:00) Europe/Helsinki","start_latlng":[61.47,23.73],"end_latlng":[61.47,23.73],"location_city":null,"location_state":null,"location_country":"Finland","start_latitude":61.47,"start_longitude":23.73,"achievement_count":0,"kudos_count":0,"comment_count":0,"athlete_count":1,"photo_count":0,"map":{"id":"a286089174","summary_polyline":"acevJwdyoCxBP\\gNbVTnDuD~AgHYyn@tI[h@w[xOhA~BmHhCLF}F~BEpDmFdGrDmEuRGeFlDiNlFeFpBeTzBis@mAal@h@}_@}@oIgOwUcGac@qRyOiFa\\yDaBfFoC\\iFf@oO{CgId@cT`JqPu@sJdHk]q@{NbHkMfAogAaEoDCcWmF{f@wCnBr@jQrCbGP|[lGjF|AnLSvf@m@rS_HjMQfNqGfPqFn@cF`MbBvIhJeEjBzB}IhSu@jSjChHUvPWtF_F~CnDdB|F~[`RtOpF|a@`PjXxAzoAaCzy@qBhTuFrEiDxOhEzYsF_F}HzG?|EaCo@aCdIgPq@]lZwIr@Ltl@{HdFaCfH_QGaBnH","resource_state":2},"trainer":false,"commute":false,"manual":false,"private":false,"flagged":false,"gear_id":null,"average_speed":4.538,"max_speed":11.9,"average_temp":0,"average_watts":99.1,"kilojoules":414.8,"device_watts":false,"truncated":null,"has_kudoed":false},{"id":286089113,"resource_state":2,"external_id":"garmin_push_747417512","upload_id":323315167,"athlete":{"id":6565991,"resource_state":1},"name":"04/14/2015 Finland","distance":17143.3,"moving_time":3047,"elapsed_time":3167,"total_elevation_gain":195,"type":"Ride","start_date":"2015-04-14T04:36:35Z","start_date_local":"2015-04-14T07:36:35Z","timezone":"(GMT+02:00) Europe/Helsinki","start_latlng":[61.47,23.73],"end_latlng":[61.47,23.73],"location_city":null,"location_state":null,"location_country":"Finland","start_latitude":61.47,"start_longitude":23.73,"achievement_count":0,"kudos_count":0,"comment_count":0,"athlete_count":1,"photo_count":0,"map":{"id":"a286089113","summary_polyline":"eaevJohyoCbBXp@yMzTjBfDmDbBaIe@um@nIOt@o\\vOdAzBcHnC@AkFzBCpDiFfGpDyE}X`DyNzFiGbCkUYgGjCuj@yAauAmO{VoG{c@oDy@uLeMiFa\\wDqBtEsBd@cGd@aPyCeH`@}SfJkQ}@oJpHi]cAoNjH}Mt@uRZei@kAcK}BuCDmUuFwg@qOdJwDtKkEtBqIv[o@jPl@l]dA~R~D~VcOf\\sDhU{VmDD`]zDr{@yAtMsKx_@aArn@cDho@In]cBfQfNtUdE`_@zLt]tD~T_CpiB}Frb@zBjA","resource_state":2},"trainer":false,"commute":false,"manual":false,"private":false,"flagged":false,"gear_id":null,"average_speed":5.626,"max_speed":12,"average_temp":0,"average_watts":112.1,"kilojoules":341.6,"device_watts":false,"truncated":null,"has_kudoed":false},{"id":284030740,"resource_state":2,"external_id":"garmin_push_744417882","upload_id":320978786,"athlete":{"id":6565991,"resource_state":1},"name":"04/12/2015 Finland","distance":25733.9,"moving_time":3917,"elapsed_time":4036,"total_elevation_gain":91,"type":"Ride","start_date":"2015-04-12T12:51:34Z","start_date_local":"2015-04-12T15:51:34Z","timezone":"(GMT+02:00) Europe/Helsinki","start_latlng":[61.58,23.46],"end_latlng":[61.47,23.73],"location_city":null,"location_state":null,"location_country":"Finland","start_latitude":61.58,"start_longitude":23.46,"achievement_count":0,"kudos_count":0,"comment_count":0,"athlete_count":1,"photo_count":0,"map":{"id":"a284030740","summary_polyline":"isyvJ_benCaBgE_D`BiF_FzDcg@zDsMZk\\dGqa@tf@c}@~Dkk@g@uW{BmN`CoMTyk@pCo]nG{c@nPkg@rHq]vD_k@xIcn@vKh@vRg}C`CqbAzD{^nH}\\~HwQdVq]|Xk[xRe|@b]kt@za@ub@r^aS~EeQbQq^jHsYjVaf@rUgfAvIwJeBo{@b@ow@bF{XnFss@v@ic@dIm{@~Mgh@fOyZdCkN\\qp@~Cgv@bDeRg@oWpc@yLr@}JaDas@`F_D|AcR[kQjFn@nHhJbKp`@~EtGr~@yHtFr_@bO~e@zAfPgBjaBgG~b@~BlA","resource_state":2},"trainer":false,"commute":false,"manual":false,"private":false,"flagged":false,"gear_id":null,"average_speed":6.57,"max_speed":10.6,"average_temp":3,"average_watts":84.5,"kilojoules":330.8,"device_watts":false,"truncated":null,"has_kudoed":false},{"id":284030697,"resource_state":2,"external_id":"garmin_push_744417800","upload_id":320978737,"athlete":{"id":6565991,"resource_state":1},"name":"04/12/2015 Finland","distance":21970.5,"moving_time":3379,"elapsed_time":7547,"total_elevation_gain":148,"type":"Ride","start_date":"2015-04-12T10:07:32Z","start_date_local":"2015-04-12T13:07:32Z","timezone":"(GMT+02:00) Europe/Helsinki","start_latlng":[61.5,23.77],"end_latlng":[61.58,23.46],"location_city":null,"location_state":null,"location_country":"Finland","start_latitude":61.5,"start_longitude":23.77,"achievement_count":1,"kudos_count":0,"comment_count":0,"athlete_count":1,"photo_count":1,"map":{"id":"a284030697","summary_polyline":"ohkvJkobpCzAlXsFfDgBjErElQgD|Ml@zCyFtT`KhKjFe@D~HgChAqApI|@bb@gCxHzAzIvBzj@vCxFrDpQn@r_@wBzJeL`OyS|hAk@nScPppBaFr\\aGv{@uQpwA\\nDiSd|@gF`Ncf@fb@mRhWgEhQvBd\\sUlTcHjKoZnp@{Rt{@}WbZmCxGy@u@_PpVkMd]sJtq@kEfyAgPbfCeLH}Htj@eEjm@}Gt[sPzg@oHlh@mCxZOjl@}B`NtA`CfAda@uDjk@mf@j|@oGhc@Yr\\uDnL}D`g@rFvE|DaBt@jF[iFmAKj@iDq@zDtArD","resource_state":2},"trainer":false,"commute":false,"manual":false,"private":false,"flagged":false,"gear_id":null,"average_speed":6.502,"max_speed":11,"average_temp":13,"average_watts":115.2,"kilojoules":389.2,"device_watts":false,"truncated":null,"has_kudoed":false},{"id":284030625,"resource_state":2,"external_id":"garmin_push_744417728","upload_id":320978677,"athlete":{"id":6565991,"resource_state":1},"name":"04/12/2015 Finland","distance":9.3,"moving_time":0,"elapsed_time":4557,"total_elevation_gain":8,"type":"Ride","start_date":"2015-04-12T08:32:25Z","start_date_local":"2015-04-12T11:32:25Z","timezone":"(GMT+02:00) Europe/Helsinki","start_latlng":[61.5,23.77],"end_latlng":[61.5,23.77],"location_city":null,"location_state":null,"location_country":"Finland","start_latitude":61.5,"start_longitude":23.77,"achievement_count":0,"kudos_count":0,"comment_count":0,"athlete_count":2,"photo_count":0,"map":{"id":"a284030625","summary_polyline":"{jkvJ{mbpCiA[","resource_state":2},"trainer":false,"commute":false,"manual":false,"private":false,"flagged":false,"gear_id":null,"average_speed":0,"max_speed":0.2,"average_temp":0,"average_watts":0,"kilojoules":0,"device_watts":false,"average_heartrate":0,"max_heartrate":194,"truncated":null,"has_kudoed":false},{"id":284030597,"resource_state":2,"external_id":"garmin_push_744417662","upload_id":320978622,"athlete":{"id":6565991,"resource_state":1},"name":"04/12/2015 Finland","distance":6215.7,"moving_time":987,"elapsed_time":987,"total_elevation_gain":49,"type":"Ride","start_date":"2015-04-12T06:04:42Z","start_date_local":"2015-04-12T09:04:42Z","timezone":"(GMT+02:00) Europe/Helsinki","start_latlng":[61.47,23.73],"end_latlng":[61.5,23.77],"location_city":null,"location_state":null,"location_country":"Finland","start_latitude":61.47,"start_longitude":23.73,"achievement_count":0,"kudos_count":0,"comment_count":0,"athlete_count":1,"photo_count":0,"map":{"id":"a284030597","summary_polyline":"acevJijyoCpAbAf@wLzBuaCwDgVcM}^kFs_@mKcS`BwP}@gDyGkK{gAsb@iGyKqD_AiAdAi@nL}HxDeMUQvSiS|@}A}F_RpCMbB","resource_state":2},"trainer":false,"commute":false,"manual":false,"private":false,"flagged":false,"gear_id":null,"average_speed":6.298,"max_speed":10,"average_temp":9,"average_watts":109,"kilojoules":107.6,"device_watts":false,"truncated":null,"has_kudoed":false},{"id":283323132,"resource_state":2,"external_id":"garmin_push_743362833","upload_id":320141320,"athlete":{"id":6565991,"resource_state":1},"name":"04/11/2015 Finland","distance":13160.9,"moving_time":1940,"elapsed_time":1969,"total_elevation_gain":62,"type":"Ride","start_date":"2015-04-11T15:21:54Z","start_date_local":"2015-04-11T18:21:54Z","timezone":"(GMT+02:00) Europe/Helsinki","start_latlng":[61.5,23.91],"end_latlng":[61.47,23.73],"location_city":null,"location_state":null,"location_country":"Finland","start_latitude":61.5,"start_longitude":23.91,"achievement_count":0,"kudos_count":0,"comment_count":0,"athlete_count":1,"photo_count":0,"map":{"id":"a283323132","summary_polyline":"_ujvJ{k|pCi@bS`DnMl@~O`EjBjBhVtF`DdA|WpFpIzCvQa@tLlJ|KpJrRvFxDvGkEdLdSva@bKrK\\dAeLtY`UgE|`AiBnGkK~LgChQUtK~A~UoD~U_DpxAlBbP~StGbC|FjE|WIh`AhExjA{AvLcK`]w@fl@cFxoAj@pAeBvPjNlVbCx\\dM`^vDvSIfeAkBrpAaBKD_C","resource_state":2},"trainer":false,"commute":false,"manual":false,"private":false,"flagged":false,"gear_id":null,"average_speed":6.784,"max_speed":11.1,"average_temp":9,"average_watts":97.8,"kilojoules":189.7,"device_watts":false,"average_heartrate":124.8,"max_heartrate":151,"truncated":null,"has_kudoed":false},{"id":283165133,"resource_state":2,"external_id":"garmin_push_743121381","upload_id":319965559,"athlete":{"id":6565991,"resource_state":1},"name":"04/11/2015 Finland","distance":95492.4,"moving_time":18457,"elapsed_time":21743,"total_elevation_gain":1138,"type":"Ride","start_date":"2015-04-11T06:11:35Z","start_date_local":"2015-04-11T09:11:35Z","timezone":"(GMT+02:00) Europe/Helsinki","start_latlng":[61.47,23.73],"end_latlng":[61.5,23.91],"location_city":null,"location_state":null,"location_country":"Finland","start_latitude":61.47,"start_longitude":23.73,"achievement_count":9,"kudos_count":0,"comment_count":0,"athlete_count":2,"photo_count":0,"map":{"id":"a283165133","summary_polyline":"obevJegyoCnCfpEzWzfG_Db{DnGtzAoVtaAin@xu@wh@hK}Ife@oNhAtUnkAj@jvBfYtvBeCfv@_}@v_@eJcjAcKqNkDbf@eRjYDjs@xOsb@_Ehr@`E_s@yOwNxW}x@yC_c@aGNtJto@sWpl@gAdg@lG`D~Mem@kD|a@dKtII|\\eLlg@a[vH{Dr]si@zb@f`@jsBjW~h@zQsn@sIaf@nFcZyJwo@fCgp@lGwAtJvn@tKmPa@rWwHjAlIjq@mIb{@hIjj@aHt@nNzY|L}d@pWdDjOrx@ir@fo@w@lpBrJhXxa@mp@fJv@jKyuDaMyGjJqYmKmJbXk_@mHcXxDyMk^gn@p@y_@q`@cPs@wo@mPeI_Oh[xFe`@uQiHXo{@qJsEnV{i@eBis@rWx@`Ik|@vYju@xYvSySkgByAyzCw]qeAgKw`AmZtLwAaeBu]cR}AkSbCzqAuGvKhCsOoM}PcCek@oHsK_L`YqRis@yJzg@_Km@[qRme@|d@qQaZcb@zr@lQcS`Cs\\qUeXW|[iQ}Cs~@fyBuFbyBvJpAsO}A}Drd@dP~G}Bzd@wIfVeLcy@eKbTjIfZoBtq@eK{a@eJa`@jIehAgPeMxSaeCnw@kgA|WgfApv@ujA~Bcq@l`AiiA|c@gzCn_@a{Eje@weBki@ocEeE}kBjQ}mClUyGeXarExNoiDzh@}mCkPs\\mBuiB","resource_state":2},"trainer":false,"commute":false,"manual":false,"private":false,"flagged":false,"gear_id":null,"average_speed":5.174,"max_speed":12.2,"average_temp":7,"average_watts":109.5,"kilojoules":2021.1,"device_watts":false,"average_heartrate":148.9,"max_heartrate":183,"truncated":null,"has_kudoed":false},{"id":282855682,"resource_state":2,"external_id":"garmin_push_742646513","upload_id":319609678,"athlete":{"id":6565991,"resource_state":1},"name":"04/10/2015 Finland","distance":5839.1,"moving_time":881,"elapsed_time":1240,"total_elevation_gain":33,"type":"Ride","start_date":"2015-04-10T14:38:42Z","start_date_local":"2015-04-10T17:38:42Z","timezone":"(GMT+02:00) Europe/Helsinki","start_latlng":[61.5,23.76],"end_latlng":[61.47,23.73],"location_city":null,"location_state":null,"location_country":"Finland","start_latitude":61.5,"start_longitude":23.76,"achievement_count":0,"kudos_count":0,"comment_count":0,"athlete_count":1,"photo_count":0,"map":{"id":"a282855682","summary_polyline":"akjvJk__pCjOoDlAsL~MqFdGvK|Bc@jA{FjA}bA`FtAvHnJxK~a@jFfF~|@{HdEnZrLx\\pEjWaB|iB}Ffa@|BzB","resource_state":2},"trainer":false,"commute":false,"manual":false,"private":false,"flagged":false,"gear_id":null,"average_speed":6.628,"max_speed":10,"average_temp":9,"average_watts":119.2,"kilojoules":105,"device_watts":false,"average_heartrate":130,"max_heartrate":167,"truncated":null,"has_kudoed":false},{"id":282855647,"resource_state":2,"external_id":"garmin_push_742646484","upload_id":319609645,"athlete":{"id":6565991,"resource_state":1},"name":"04/10/2015 Finland","distance":23081.7,"moving_time":3818,"elapsed_time":4626,"total_elevation_gain":215,"type":"Ride","start_date":"2015-04-10T04:39:20Z","start_date_local":"2015-04-10T07:39:20Z","timezone":"(GMT+02:00) Europe/Helsinki","start_latlng":[61.47,23.73],"end_latlng":[61.5,23.76],"location_city":null,"location_state":null,"location_country":"Finland","start_latitude":61.47,"start_longitude":23.73,"achievement_count":0,"kudos_count":0,"comment_count":0,"athlete_count":1,"photo_count":0,"map":{"id":"a282855647","summary_polyline":"uaevJefyoCnA`@n@eNdU`AbEkE|AaHc@}n@zIg@\\e[jP~@tBiHrCCEcFfCCzDsFpF|DsEsXzCgOtF_GvBuS~B{t@iA{j@l@g^y@}ImO_WcG{b@sDiAcM{MqEcZsC{AlC`EvAuBy@_Jv@cUuC{Hb@}S~IgPw@{JnHw]cAgNbHoLz@qTTas@{DgE@wTwFih@iOrIgD|JsE~BuIf[s@vYhAf_@zFv_@gPf^}CxScWyDHr_@xDvy@gBbOkI|UsApMc@lh@}EflAj@tAaBzO~MxTxGlj@fHvQpE|UsAxjBoArCoDt]vEnE~BisCmDmTiNcb@eD{Wy}@bIwF{G}Is^{MwMoBtC}@r}@aAlEaC`AsGkKkMxEPpJuTzF","resource_state":2},"trainer":false,"commute":false,"manual":false,"private":false,"flagged":false,"gear_id":null,"average_speed":6.045,"max_speed":12.1,"average_temp":1,"average_watts":118,"kilojoules":450.4,"device_watts":false,"average_heartrate":143.6,"max_heartrate":180,"truncated":null,"has_kudoed":false},{"id":282251169,"resource_state":2,"external_id":"garmin_push_741792259","upload_id":318922311,"athlete":{"id":6565991,"resource_state":1},"name":"04/09/2015 Finland","distance":17081.8,"moving_time":3312,"elapsed_time":3431,"total_elevation_gain":190,"type":"Ride","start_date":"2015-04-09T04:41:09Z","start_date_local":"2015-04-09T07:41:09Z","timezone":"(GMT+02:00) Europe/Helsinki","start_latlng":[61.47,23.73],"end_latlng":[61.47,23.73],"location_city":null,"location_state":null,"location_country":"Finland","start_latitude":61.47,"start_longitude":23.73,"achievement_count":0,"kudos_count":0,"comment_count":0,"athlete_count":1,"photo_count":0,"map":{"id":"a282251169","summary_polyline":"eaevJkgyoCrA`@n@oN|SxBlEeE`BqI]wm@lIFt@{\\rOvAhCwHhCBAiFdCAhDkF~FxDmEeYvCkN~FuGpBaRbCgv@iAck@f@}]y@}JgOeVgGkc@{DkA{KwL}Fi\\wDkBtEeCfAaSKgEcCkFZeT|IgQu@iJpHe^_AeN~GwL|@cSZki@qAwKuBuBBeVqFig@}OdJyDzKoEvBmIb]_@vWfAl]zFn`@}Ot]gDtTcWuCHd^zDxy@oAxL{Kx_@kAtq@eDlo@?z\\cBbPlN|UfCb]jLr\\pEnUqAtkB}Flb@|BdA","resource_state":2},"trainer":false,"commute":false,"manual":false,"private":false,"flagged":false,"gear_id":null,"average_speed":5.158,"max_speed":11.2,"average_temp":1,"average_watts":97.5,"kilojoules":322.9,"device_watts":false,"average_heartrate":132.7,"max_heartrate":165,"truncated":null,"has_kudoed":false},{"id":281555479,"resource_state":2,"external_id":"garmin_push_740818882","upload_id":318138255,"athlete":{"id":6565991,"resource_state":1},"name":"04/08/2015 Finland","distance":27925,"moving_time":5307,"elapsed_time":7444,"total_elevation_gain":353,"type":"Ride","start_date":"2015-04-08T14:44:56Z","start_date_local":"2015-04-08T17:44:56Z","timezone":"(GMT+02:00) Europe/Helsinki","start_latlng":[61.5,23.76],"end_latlng":[61.47,23.73],"location_city":null,"location_state":null,"location_country":"Finland","start_latitude":61.5,"start_longitude":23.76,"achievement_count":2,"kudos_count":0,"comment_count":0,"athlete_count":1,"photo_count":0,"map":{"id":"a281555479","summary_polyline":"okjvJgc_pC|N_A^yHpNuGdGjJhCe@nAkFJe_@jBiSYmNzHdC~FpI~Ib^dFdHt~@qHnDhYtNdb@|CnS{AlhBaGlc@hCh@sAA`BjDv@GZoMfVX`EsEzA{H[cn@hIRj@{[xOr@pCsHzBJFmFpB@fEqF|F`D{E{WdDsOrFsFrBcQdCkv@kAsl@\\aa@iAgIoCiEiGqGmBdDxAwEcIog@}RsPqEaZqCoAjCtDvAsBo@{Iv@_UqCkHXmTuCdEg@xNwBhEfGxOHxItA_@fAeWyC_Ib@kSfJaRy@cJtHs]eA}MnH{MhAo|@yA_LoBgBB_UuFei@wOfJoDtK_FzBcIp[Yxb@|A|]lE~S`LyEbFxGlK~F~@vJ_@dLeGpWn@bIsI~Ps@tS`CjETjF{@vRaB~AzAc@v@vG{ArAaCyDbCz@rFd[hRhPpFra@tN~TxAdKc@~_@pAdi@_Cjv@iBnTwG~G`EuE_BlBe@rRvIbAk@tMj@|CqFlE}I}HyHfGCpFcCM}BhH_PuAe@b]rBfDz@dOYf_@o@dIsDnKsOrAkAbKsJtJoCnHgC}Dg@_RmH}DhA}I~@h@","resource_state":2},"trainer":false,"commute":false,"manual":false,"private":false,"flagged":false,"gear_id":null,"average_speed":5.262,"max_speed":12.6,"average_temp":3,"average_watts":121.2,"kilojoules":643.1,"device_watts":false,"average_heartrate":138.1,"max_heartrate":175,"truncated":null,"has_kudoed":false},{"id":281555423,"resource_state":2,"external_id":"garmin_push_740818806","upload_id":318138178,"athlete":{"id":6565991,"resource_state":1},"name":"04/08/2015 Finland","distance":20105.7,"moving_time":3308,"elapsed_time":4366,"total_elevation_gain":229,"type":"Ride","start_date":"2015-04-08T04:45:01Z","start_date_local":"2015-04-08T07:45:01Z","timezone":"(GMT+02:00) Europe/Helsinki","start_latlng":[61.47,23.73],"end_latlng":[61.5,23.76],"location_city":null,"location_state":null,"location_country":"Finland","start_latitude":61.47,"start_longitude":23.73,"achievement_count":0,"kudos_count":0,"comment_count":0,"athlete_count":1,"photo_count":0,"map":{"id":"a281555423","summary_polyline":"{}dvJshyoCXuKrTxA|DqExA{GWco@pII`@m[jOnApCuHfCJFsF|BC|DyFhEtEv@w@aFoVbDwPrF{FtBcS~Bys@eAam@j@_\\{AgNoNuTqGkc@_Ds@_MsMgFu[aC_@fCxDzAqBs@_Jv@aUuCyH`@}S`JiQy@oIjHm^u@cP_SkPwHjDkE|GkL|XkDzT{VmE@`]zDd{@sAhNwKfa@}@zm@eDbo@u@`\\l@lAeBpPhNbVrG`i@vHlRbEjVyAvgB{Fzb@~@~AEwK|D}WpBibByB}SyNad@uFa^m{@pJqHeIiIs]yMeNqBlCkAj~@eA|DsBv@eH_KcMhEJ`K{RpF","resource_state":2},"trainer":false,"commute":false,"manual":false,"private":false,"flagged":false,"gear_id":null,"average_speed":6.078,"max_speed":12.3,"average_temp":3,"average_watts":134.2,"kilojoules":443.8,"device_watts":false,"average_heartrate":143.7,"max_heartrate":176,"truncated":null,"has_kudoed":false},{"id":280933629,"resource_state":2,"external_id":"garmin_push_739928511","upload_id":317440502,"athlete":{"id":6565991,"resource_state":1},"name":"04/07/2015 Finland","distance":26764,"moving_time":5504,"elapsed_time":5866,"total_elevation_gain":372,"type":"Ride","start_date":"2015-04-07T14:18:38Z","start_date_local":"2015-04-07T17:18:38Z","timezone":"(GMT+02:00) Europe/Helsinki","start_latlng":[61.47,23.76],"end_latlng":[61.47,23.73],"location_city":null,"location_state":null,"location_country":"Finland","start_latitude":61.47,"start_longitude":23.76,"achievement_count":3,"kudos_count":0,"comment_count":0,"athlete_count":1,"photo_count":0,"map":{"id":"a280933629","summary_polyline":"}bdvJgd_pClE`PbGoFjAx@nDzO|A@lM|^^`JxCk@`D_FxEbF\\gDoDkLc@cHnDuNlG_K~Dey@w@{w@l@sZiAeNsMaRuHof@oR_P}Ea[}DiBrE_DfAgRS}F}BmF`@aSrIsPi@kKjHa]}@yNxGkL~@aU`@ch@oAmKwB_C?mWmF_f@yOzI{DpLaF~B}GvVaA|JdA|p@tFv\\bLmEjF`HrJbFfAlJMjKeGhVd@tKwOnZEnOpGbJaCtNDhBdAApAyVsCqIh@{SnIuPm@yJhHu^y@qM|GiM|@oSRwr@}DcEFeTsFci@cPtIiDpK_GfEsHf\\M~_@bBj^jErSpLgFnE`HrJhG|AfJ]fLwFhUr@fJiOhYaAlZhDjJExH`BD|@fGmAxBmCqDbCXtFl\\pQtN|F|a@xNlUrAhJ]tb@bAjo@uFtwApDbDgAnPh@bDaEpDoDy@\\}DuEoQx@{F_AzFhD|Kh@tHgF_E_FfGoBSUuIgKmZqDwCm@yG{CeHuH`GkEwPvDdQ_[n]oC|cByF~`@d@lB","resource_state":2},"trainer":false,"commute":false,"manual":false,"private":false,"flagged":false,"gear_id":null,"average_speed":4.863,"max_speed":11.7,"average_temp":5,"average_watts":112,"kilojoules":616.6,"device_watts":false,"average_heartrate":150.3,"max_heartrate":186,"truncated":null,"has_kudoed":false},{"id":280933602,"resource_state":2,"external_id":"garmin_push_739928477","upload_id":317440469,"athlete":{"id":6565991,"resource_state":1},"name":"04/07/2015 Pirkanmaa, Finland","distance":20501.1,"moving_time":3664,"elapsed_time":3771,"total_elevation_gain":246,"type":"Ride","start_date":"2015-04-07T04:44:32Z","start_date_local":"2015-04-07T07:44:32Z","timezone":"(GMT+02:00) Europe/Helsinki","start_latlng":[61.47,23.73],"end_latlng":[61.47,23.76],"location_city":null,"location_state":"Pirkanmaa","location_country":"Finland","start_latitude":61.47,"start_longitude":23.73,"achievement_count":1,"kudos_count":0,"comment_count":0,"athlete_count":1,"photo_count":0,"map":{"id":"a280933602","summary_polyline":"udevJuhyoCjDrBd@iN|Ux@lD}D`B_IYqn@pIEd@q[|O`AzBiHtCO@_FtBBxDqF`GpDyEqXhD}OrFmFpBuS`Cks@kAgl@n@_Z}@yNyM}RiIog@aDm@yLoMiFw[uDsBrEwBdAeSImEkCqHd@mRzIkPs@uJjHu^cAgMpH_Mn@oS^oh@uAeLqB}BB{TyF_i@wOrJsDnKoEtB}HvYw@tNhBpr@vEnU`L{EhF~GdKlF~@tJ_@`MaGbU~@|IoIhNmAzV~CpI{@vTp@rJ}A|DfGh`@m@hOuNvj@_JnOqQ_@eAbO{OnD|@lJcBz@wGtRgBpCiGmJiBhQdN~UvGfi@nH|QbEtTqArjB}Fhe@l@b@m@wCzFia@rCacBzZu\\yDgQ","resource_state":2},"trainer":false,"commute":false,"manual":false,"private":false,"flagged":false,"gear_id":null,"average_speed":5.595,"max_speed":15.1,"average_temp":0,"average_watts":118.9,"kilojoules":435.8,"device_watts":false,"average_heartrate":152.6,"max_heartrate":184,"truncated":null,"has_kudoed":false},{"id":279561095,"resource_state":2,"external_id":"garmin_push_737693329","upload_id":315875188,"athlete":{"id":6565991,"resource_state":1},"name":"04/05/2015 Finland","distance":88398.5,"moving_time":17504,"elapsed_time":18907,"total_elevation_gain":1096,"type":"Ride","start_date":"2015-04-05T05:26:24Z","start_date_local":"2015-04-05T08:26:24Z","timezone":"(GMT+02:00) Europe/Helsinki","start_latlng":[61.47,23.73],"end_latlng":[61.47,23.73],"location_city":null,"location_state":null,"location_country":"Finland","start_latitude":61.47,"start_longitude":23.73,"achievement_count":3,"kudos_count":0,"comment_count":0,"athlete_count":2,"photo_count":0,"map":{"id":"a279561095","summary_polyline":"i`evJajyoCdD_nC}WeoAk~@lGsYsq@sI}@uAzb@sEjAdDn_BwSzFi@vc@oHnYqNdJu@tr@s^zeAkL`eAuOzuBx@pqBc}A`uE{Yj_@dD|eAsVs@?~[qLwEyN|h@ek@jf@|GlIiPn^j@rhByLbPwD|d@nPvL}Lnw@{Hey@oNtNdI|_AkIbi@{SabAr[khF|PlJlKse@zh@c]n^~Uj]ys@aAcd@~HgN~Jzi@dR}RiCfK~LxHoJqApXkXfJvLaAccArQb@cDui@lFor@a[zBsDi`@bKc[cGoFyHdW`BoW~f@aiBxOgRv\\r}B_Thb@lDfw@jb@zg@~HnbAbSyd@uOe{AtEzRkGjLhIhF`Cd~@{Nri@vIz^nGqA~Cf`@eOxE|J`KgB`ScUdGuFx]pGs@|Glk@zSmEP|_A`^ucAx_@nfApDveDhXzoBo^_]aQ}m@uFkFcFhPiB|k@mXw@nBxr@yVlh@{Alh@xGrCfMul@aGjbAdOtHyEv_@tW{WjA~`@bGpEClQkNxA{D~OrD`dA{NzeAdG|^|o@tAbEpq@|QbGjBdgAd_@}LqJuHyDim@_PMhBgp@oMdBh@si@hh@{w@eBwr@g]ea@gYsyAw]gh@sKstAkNeZNc`Bk`@{mCcNaJgEwgBbVu[pr@}LlNxErHv]nWdEb@nKr`@eGvt@cz@xPog@`AwoHwW_hGjCioBoGkaB","resource_state":2},"trainer":false,"commute":false,"manual":false,"private":false,"flagged":false,"gear_id":null,"average_speed":5.05,"max_speed":11.2,"average_temp":0,"average_watts":99.9,"kilojoules":1748.3,"device_watts":false,"average_heartrate":145.4,"max_heartrate":178,"truncated":null,"has_kudoed":false},{"id":278909608,"resource_state":2,"external_id":"garmin_push_736711591","upload_id":315125722,"athlete":{"id":6565991,"resource_state":1},"name":"04/04/2015 Finland","distance":50215.4,"moving_time":12247,"elapsed_time":13198,"total_elevation_gain":588,"type":"Ride","start_date":"2015-04-04T05:43:39Z","start_date_local":"2015-04-04T08:43:39Z","timezone":"(GMT+02:00) Europe/Helsinki","start_latlng":[61.47,23.73],"end_latlng":[61.47,23.73],"location_city":null,"location_state":null,"location_country":"Finland","start_latitude":61.47,"start_longitude":23.73,"achievement_count":1,"kudos_count":0,"comment_count":0,"athlete_count":1,"photo_count":0,"map":{"id":"a278909608","summary_polyline":"{`evJmdyoC|@cNd\\{CdAsw@pIUx@s\\vOjAzPeW`GlDoE{XtKyW`Fc{@mAkcB}NoUqGyc@oR{OeFe[wDqBhE_ChAaRgCaOb@sStIwPc@wJ`Ha^cAoMbH{Lv@oSd@oi@kA{JoEgDbBqO{Fkm@qGj_@cJvHjFtYzJrSqGba@{G`MbRjOj@zJ_HdTkDbA|FlWgMzSoBvTkEiIu@tJrHtIpBjR~Aa@lA{TsC_JZ_ThJoRy@}IpHa]w@uMtG}Mz@kT^cg@mEePyAml@}CiQ{LrHNsHtJgSqIoo@lIsBkCit@qJwI}JvGaLwWy_@mMw[kVcA`LkK]u_@iIuNoUsJbE_z@anAfAku@wPwBSvO_Xv}@oJtJ_B|KzCdCp@rQyBjt@a^{J}ExG`H|PdGja@qFdPhAtSgCbw@aIxFqQn]lIlDnLra@x@j\\aCvHtFvk@{F|xA{GlGgN{|@U_b@lDwZiAuk@{Ryj@wLxEEcT}Qqg@|B_v@nE}KqE{QEw[bS{KhDus@~IkA~Czf@pGvCvItzAhVngAjMtFvVwHsA~|@lWljEvPltAx`@li@lqBcEyFr|AhLfRtDb^lNhb@xDf\\uCduC~Cn_An@q\\oDoKc@eTyHmCjBqLzB~@","resource_state":2},"trainer":false,"commute":false,"manual":false,"private":false,"flagged":false,"gear_id":null,"average_speed":4.1,"max_speed":12,"average_temp":0,"average_watts":85.5,"kilojoules":1046.6,"device_watts":false,"average_heartrate":133.6,"max_heartrate":167,"truncated":null,"has_kudoed":false},{"id":278589195,"resource_state":2,"external_id":"garmin_push_736202149","upload_id":314756323,"athlete":{"id":6565991,"resource_state":1},"name":"04/03/2015 Finland","distance":62056.1,"moving_time":12074,"elapsed_time":13979,"total_elevation_gain":594,"type":"Ride","start_date":"2015-04-03T06:28:08Z","start_date_local":"2015-04-03T09:28:08Z","timezone":"(GMT+02:00) Europe/Helsinki","start_latlng":[61.47,23.73],"end_latlng":[61.47,23.73],"location_city":null,"location_state":null,"location_country":"Finland","start_latitude":61.47,"start_longitude":23.73,"achievement_count":3,"kudos_count":0,"comment_count":0,"athlete_count":1,"photo_count":0,"map":{"id":"a278589195","summary_polyline":"k_evJ}iyoCrBipCoSwu@iCmVm~@zGwFsGqKoa@uIyJgEpBmAra@uE`AtD``BsTrFWrc@mHvXwNlJsC~}@wNpY_Q`t@mPfiCiFd\\x@dsBwI`KkUxeA}q@|_BcIta@gQnPqLvo@gM|Y_TjT}OcBoH`d@{b@pk@yMhq@rBjGvBwEbDgY~FqIlh@iWtLdFvXva@|`B\\b`Abb@lG~_CzM|Hpb@z|CwBdf@tBzlAoFfVoOdSyAlg@~ApGbCkAzDq_@fAqEzCvFKrd@uCfM`OxHwEn_@lXaVxDfg@xCdMlFlC_A`Zbb@zXcEhDgCzw@yEhU|Rn]uBr`@|LXhAnFcDni@zNhDvEph@rE?dD`IyPWyL`Ng@yg@aE}NpBqNiDkFgEjJ{F{KoHyg@tBiHkM\\gAdH{GsI_NxIwDeDqIsd@s@jTeEWz@}PwH`F_Nlb@y[}x@uF{k@fCcQoByHmKe@eHgYnAwHdMwDjIki@jMcNrS|IxDsJdHuBzFk]fEyEaOaItCyOFcb@yC{FgArE_En_@yBpA_BuFlAwh@nOcSrFeW}BekArBei@ac@{|CiMoFkEshBtTwZ|a@_@tQmL~I||@rRzi@xHsO`Fa^`i@wK~n@yv@mAcO~DaL|HL|Hsd@sFyh@g@ap@tDk`AMezBgLoeBt@}|@uLwhBzCmdB_HkfB","resource_state":2},"trainer":false,"commute":false,"manual":false,"private":false,"flagged":false,"gear_id":null,"average_speed":5.14,"max_speed":12.6,"average_temp":0,"average_watts":94.6,"kilojoules":1142.5,"device_watts":false,"average_heartrate":137.3,"max_heartrate":180,"truncated":null,"has_kudoed":false},{"id":278589095,"resource_state":2,"external_id":"garmin_push_736202077","upload_id":314756258,"athlete":{"id":6565991,"resource_state":1},"name":"04/02/2015 Finland","distance":17451.4,"moving_time":3321,"elapsed_time":3673,"total_elevation_gain":191,"type":"Ride","start_date":"2015-04-02T14:32:11Z","start_date_local":"2015-04-02T17:32:11Z","timezone":"(GMT+02:00) Europe/Helsinki","start_latlng":[61.47,23.76],"end_latlng":[61.47,23.73],"location_city":null,"location_state":null,"location_country":"Finland","start_latitude":61.47,"start_longitude":23.76,"achievement_count":0,"kudos_count":0,"comment_count":0,"athlete_count":1,"photo_count":0,"map":{"id":"a278589095","summary_polyline":"ybdvJqb_pCfEjNtHmFxC|H`@|FbCv@|Lf^XlIrCa@tDgFvExETqDsEgTzC{NrGkJjE}z@{@_v@j@g^eAoK}MeSoHgf@eR_O}Eo[aEoBnEuChAcQK}G}BwF^iSvIoPk@aK`Hc]y@yN`HoL|@aV^uf@sAsKsBeCB_UsFsh@{OxIaD|JcFlC}It^n@fu@vFz`@uOh]uDpUuVuE@|]dE~y@kAtMwI|VuAhJa@~b@uFvvAj@dAcBxP|JnQdBj@\\~CzO`CxV~PdHdG`L|Q}GhHkEaQtDhQa[x]kC`dBiAfBsDv]zBbA","resource_state":2},"trainer":false,"commute":false,"manual":false,"private":false,"flagged":false,"gear_id":null,"average_speed":5.255,"max_speed":10.7,"average_temp":0,"average_watts":102.9,"kilojoules":341.7,"device_watts":false,"average_heartrate":133.8,"max_heartrate":172,"truncated":null,"has_kudoed":false},{"id":278589085,"resource_state":2,"external_id":"garmin_push_736202025","upload_id":314756212,"athlete":{"id":6565991,"resource_state":1},"name":"04/02/2015 Finland","distance":19082.5,"moving_time":3285,"elapsed_time":3511,"total_elevation_gain":206,"type":"Ride","start_date":"2015-04-02T04:49:02Z","start_date_local":"2015-04-02T07:49:02Z","timezone":"(GMT+02:00) Europe/Helsinki","start_latlng":[61.47,23.73],"end_latlng":[61.47,23.76],"location_city":null,"location_state":null,"location_country":"Finland","start_latitude":61.47,"start_longitude":23.73,"achievement_count":0,"kudos_count":0,"comment_count":0,"athlete_count":1,"photo_count":0,"map":{"id":"a278589085","summary_polyline":"ccevJqeyoCzBRLqM|OXbDwH|HwFUcl@nIEf@c\\bP~@dCsHbCL@uFzBJ|D}F|FxDuEwXxCcO|FwFtB_S~Bkx@kAei@n@k[aAkL_O{UuGid@kD{@qL_MkFs[{DmBtEwC|@aSeC}MX}R~I_Qw@kJjHk^u@sMxG}Lr@_Td@ei@qAaKqB_CG_VeFug@sOzI_DxJqFzCeIvZq@xWv@`[hAfPbEbTgPz^iDfTuV}CJh]zDly@iAtLiJfYyAxMa@tg@}E`mAn@rAiBlO~MbUhE~_@tLl]dElWgCphBuAdDeDt\\zAfBwAeAzFie@d@}y@pBmg@pCaAbViZgCgM","resource_state":2},"trainer":false,"commute":false,"manual":false,"private":false,"flagged":false,"gear_id":null,"average_speed":5.809,"max_speed":12.8,"average_temp":0,"average_watts":121.6,"kilojoules":399.3,"device_watts":false,"average_heartrate":155.2,"max_heartrate":186,"truncated":null,"has_kudoed":false},{"id":278590206,"resource_state":2,"external_id":"garmin_push_736201982","upload_id":314756171,"athlete":{"id":6565991,"resource_state":1},"name":"04/01/2015 Finland","distance":21237.9,"moving_time":3116,"elapsed_time":3290,"total_elevation_gain":127,"type":"Ride","start_date":"2015-04-01T14:32:17Z","start_date_local":"2015-04-01T17:32:17Z","timezone":"(GMT+02:00) Europe/Helsinki","start_latlng":[61.5,23.74],"end_latlng":[61.47,23.73],"location_city":null,"location_state":null,"location_country":"Finland","start_latitude":61.5,"start_longitude":23.74,"achievement_count":0,"kudos_count":0,"comment_count":0,"athlete_count":1,"photo_count":0,"map":{"id":"a278590206","summary_polyline":"sijvJim{oCkBh_@Qhb@oBbL{O~[mN`k@mHfw@}@df@kFzq@iFz]Wzt@lFjlAoArNpLfaAjDvDrGb_AgCve@cEfNhAzJdCzoFj@nMhBvBfJwQhIwEl]P|FoAjKoJtJj_AtQ|g@jHoMrBmVtBiHdj@wL`n@av@w@cPvB{@`AaJrDtCzBeBdIme@aDgRmAmVg@yr@vDy}@mAcg@|@ipA_LecBf@oaAcLkbBtCsvAe@ci@qAgBZ_]mBq]uHkFnAiKjCbB","resource_state":2},"trainer":false,"commute":false,"manual":false,"private":false,"flagged":false,"gear_id":null,"average_speed":6.816,"max_speed":12.5,"average_temp":1,"average_watts":101.3,"kilojoules":315.7,"device_watts":false,"truncated":null,"has_kudoed":false},{"id":277333873,"resource_state":2,"external_id":"garmin_push_734287753","upload_id":313341257,"athlete":{"id":6565991,"resource_state":1},"name":"04/01/2015 Finland","distance":22512.6,"moving_time":3547,"elapsed_time":3789,"total_elevation_gain":184,"type":"Ride","start_date":"2015-04-01T04:43:59Z","start_date_local":"2015-04-01T07:43:59Z","timezone":"(GMT+02:00) Europe/Helsinki","start_latlng":[61.47,23.73],"end_latlng":[61.5,23.76],"location_city":null,"location_state":null,"location_country":"Finland","start_latitude":61.47,"start_longitude":23.73,"achievement_count":2,"kudos_count":0,"comment_count":0,"athlete_count":1,"photo_count":0,"map":{"id":"a277333873","summary_polyline":"obevJujyoCfBdIXjZnAdK_@n[nAzA^dUqCtjB`LraBc@hbAbLjcB_AppApA`g@yDf_Aj@xr@bBnYhC`NeCbJoBnTcPtW^lHwk@|s@ul@xN}AxEyBxWqHxMeRci@aNetAmGgpAkCiUqAzToGjK~@n`@bCnMwD|IwFkAcBy@iEoQ|Gwh@_@yi@x@iOvCqLGqMiHw{@uDyO{Hev@uBad@aDcXaDyMiIuQqPyMyFodAAclAzEeXrEyj@zAim@jG_r@hPmr@lOe[zBmNLug@rEwuAkA_Ju@og@eBK","resource_state":2},"trainer":false,"commute":false,"manual":false,"private":false,"flagged":false,"gear_id":null,"average_speed":6.347,"max_speed":10.4,"average_temp":0,"average_watts":105.4,"kilojoules":373.9,"device_watts":false,"truncated":null,"has_kudoed":false},{"id":276960544,"resource_state":2,"external_id":"garmin_push_733737620","upload_id":312925771,"athlete":{"id":6565991,"resource_state":1},"name":"03/31/2015 Finland","distance":31268.1,"moving_time":6187,"elapsed_time":6359,"total_elevation_gain":322,"type":"Ride","start_date":"2015-03-31T14:20:59Z","start_date_local":"2015-03-31T17:20:59Z","timezone":"(GMT+02:00) Europe/Helsinki","start_latlng":[61.47,23.73],"end_latlng":[61.47,23.73],"location_city":null,"location_state":null,"location_country":"Finland","start_latitude":61.47,"start_longitude":23.73,"achievement_count":3,"kudos_count":0,"comment_count":0,"athlete_count":1,"photo_count":0,"map":{"id":"a276960544","summary_polyline":"obevJmiyoC|B~@LsLlUxA~DeE`BmJY}l@hIBl@e\\|O|@~BgHfCFFqFlCQbDeFhGpDuEyX|C{NzF_GnBiRbCsv@{A}sAyNaV{G_e@sDeAoLaMoFw[wD}BlEuBnA}RGsEkCsH^gRtImPm@{JnHe]}@kNfHeNv@iUX{f@yAmKeB{BG}VkF{f@uO`JmDtKiFfCkHpXaAtSh@|[hAvSpEpUwOv]kDtUtFrDbI`RdCrPQvMvI`JzBpIKhGbBNrAyVuC_Jb@}RzIgQm@}JhHq\\y@}N|GyM~A{t@wAaS}BoCs@mc@sDyYiFvBeIzFyDpKgEjBuG|UoAjMN`]xAxZvExUmPr_@uChT|FzDhIxRvBbVyGnu@{Hz\\]bM{C`KbHxV^r[fHZbS__@fSbStGcB|H{MjLfP`AtKm@|]jAdk@qE~eAf@`CqAbUcFtAyByE_AjCvEfXyHkBdIrAgEwQd@_IjBnEhKr@u@nMl@rD}CdDsEu@`@yDwEmR`AuEpAfEvK|@s@fMj@`E}EpDiCiA\\gDyE}Rt@iE|BvEzJn@s@tMj@zCw@bBuH^X_EwE}Qz@uErBfEbKx@u@`Mj@dDaAnBqEvAgIsHwDvF{BXAnFaC_AeClI_P{@e@b\\sIHt@`O_@h\\{HlFwDzHkTo@aArGvBn@","resource_state":2},"trainer":false,"commute":false,"manual":false,"private":false,"flagged":false,"gear_id":null,"average_speed":5.054,"max_speed":13,"average_temp":0,"average_watts":95.5,"kilojoules":590.8,"device_watts":false,"truncated":null,"has_kudoed":false},{"id":276960521,"resource_state":2,"external_id":"garmin_push_733737572","upload_id":312925724,"athlete":{"id":6565991,"resource_state":1},"name":"03/30/2015 Finland","distance":5853,"moving_time":896,"elapsed_time":896,"total_elevation_gain":34,"type":"Ride","start_date":"2015-03-30T17:24:01Z","start_date_local":"2015-03-30T20:24:01Z","timezone":"(GMT+02:00) Europe/Helsinki","start_latlng":[61.5,23.76],"end_latlng":[61.47,23.73],"location_city":null,"location_state":null,"location_country":"Finland","start_latitude":61.5,"start_longitude":23.76,"achievement_count":0,"kudos_count":0,"comment_count":0,"athlete_count":1,"photo_count":0,"map":{"id":"a276960521","summary_polyline":"ekjvJo__pCrTyEYcHpKwHlGnKbCu@dAiEKs`@bB_PSgLpB}BdMhMzIl^|EbHx~@yHjEv[nLp\\`E`UiBjeC{Dv@g@jF|ArA","resource_state":2},"trainer":false,"commute":false,"manual":false,"private":false,"flagged":false,"gear_id":null,"average_speed":6.532,"max_speed":10.6,"average_temp":4,"average_watts":109.5,"kilojoules":98.1,"device_watts":false,"truncated":null,"has_kudoed":false},{"id":276960494,"resource_state":2,"external_id":"garmin_push_733737539","upload_id":312925679,"athlete":{"id":6565991,"resource_state":1},"name":"03/30/2015 Finland","distance":4867,"moving_time":874,"elapsed_time":874,"total_elevation_gain":31,"type":"Ride","start_date":"2015-03-30T13:14:26Z","start_date_local":"2015-03-30T16:14:26Z","timezone":"(GMT+02:00) Europe/Helsinki","start_latlng":[61.47,23.76],"end_latlng":[61.5,23.76],"location_city":null,"location_state":null,"location_country":"Finland","start_latitude":61.47,"start_longitude":23.76,"achievement_count":0,"kudos_count":0,"comment_count":0,"athlete_count":1,"photo_count":1,"map":{"id":"a276960494","summary_polyline":"ibdvJuc_pCw@{FaC~ApBuE]iDqe@qVghApImEkG_Jo^oMsMoBrBiAt~@w@tDiCjAkGoKsMtFN~JcThF","resource_state":2},"trainer":false,"commute":false,"manual":false,"private":false,"flagged":false,"gear_id":null,"average_speed":5.569,"max_speed":10,"average_temp":4,"average_watts":89.1,"kilojoules":77.8,"device_watts":false,"truncated":null,"has_kudoed":false},{"id":276960435,"resource_state":2,"external_id":"garmin_push_733737505","upload_id":312925656,"athlete":{"id":6565991,"resource_state":1},"name":"03/30/2015 Finland","distance":16488.7,"moving_time":3530,"elapsed_time":3659,"total_elevation_gain":196,"type":"Ride","start_date":"2015-03-30T04:42:32Z","start_date_local":"2015-03-30T07:42:32Z","timezone":"(GMT+02:00) Europe/Helsinki","start_latlng":[61.47,23.73],"end_latlng":[61.47,23.76],"location_city":null,"location_state":null,"location_country":"Finland","start_latitude":61.47,"start_longitude":23.73,"achievement_count":0,"kudos_count":0,"comment_count":0,"athlete_count":1,"photo_count":0,"map":{"id":"a276960435","summary_polyline":"ebevJyiyoCI|A~A~@LmM~PIlCiHlH}EI}l@nIGj@}[`Pz@tBcHtCQ?_F`BP~EcG`FtEmEyXbD}OzF}FxBmTzBaw@oAqh@n@q[eAeMsNyTsGad@mR{OeFi[{DqBxEiC\\yEd@{PoCqI\\kRbA}E`HqJ{@iJnHa^}@mN|GaLz@}UZog@sAoKqBuCK_VgFcg@{OjJ_DlKoFzC}Hd[i@fSz@~^`Gfe@yOz]kDrTuV}DBz\\bEvx@{AnPoKb^cH`}Bl@xAgBtPbOhXxOtBdX~Q`GjFlKvQqGvGkEcP","resource_state":2},"trainer":false,"commute":false,"manual":false,"private":false,"flagged":false,"gear_id":null,"average_speed":4.671,"max_speed":12.8,"average_temp":0,"average_watts":98.6,"kilojoules":348,"device_watts":false,"average_heartrate":134.9,"max_heartrate":168,"truncated":null,"has_kudoed":false},{"id":275800098,"resource_state":2,"external_id":"garmin_push_731816521","upload_id":311611916,"athlete":{"id":6565991,"resource_state":1},"name":"03/29/2015 Finland","distance":67007.4,"moving_time":11835,"elapsed_time":14372,"total_elevation_gain":745,"type":"Ride","start_date":"2015-03-29T05:39:28Z","start_date_local":"2015-03-29T08:39:28Z","timezone":"(GMT+02:00) Europe/Helsinki","start_latlng":[61.47,23.73],"end_latlng":[61.47,23.73],"location_city":null,"location_state":null,"location_country":"Finland","start_latitude":61.47,"start_longitude":23.73,"achievement_count":1,"kudos_count":0,"comment_count":0,"athlete_count":2,"photo_count":0,"map":{"id":"a275800098","summary_polyline":"wbevJegyoChHz}AmC`oB~WfjGgDnxDtGl|AkGha@aJ|@aEdLr@fP_h@pp@iWzKuStmBVzbC|ObsAOdrAc\\r]cYsAmF`KfDlPwMx`@uZcJvC}QeCjSre@dDsMr{@Fpv@}CrSmEg@nJx`@pYo}@|_@xTnK}_@vZfZdx@x|FdGvtAvNyZe@aU`CvTuB_UMxXHoXxBnTaCeTUjYNaZxBrTuB}S[zYV_ZrBrTsBgTdAbPyGfVoAgXhIwCIcJvAhU@mMuB}EOhYViZUzYZ}Y`BrURiLaCiGSdYFcZvB`UcBuTt@rQkKha@g@rt@oImjCcs@}bFaFioB~H{E|D{U`OUnMpIpJ~a@qGch@jf@yAs[mlBoFj@ydAeqCiFkrAkJ{WwCia@vSqnBdVmJzh@{q@zVqaAoGa{AbDwzD_XgjGvAkrCnQqs@~Mi@rFcLjBm{A`KSxP_WfG~C}EcWtLg[rEsz@kBedBsKsMyLbP_MiFiMfw@wHN`AaQoKiQyLy@u@bNyKxEgQqC_Jvo@zJdRt[b_BaI|gC","resource_state":2},"trainer":false,"commute":false,"manual":false,"private":false,"flagged":false,"gear_id":null,"average_speed":5.662,"max_speed":11.2,"average_temp":0,"average_watts":103.8,"kilojoules":1228.6,"device_watts":false,"average_heartrate":133.1,"max_heartrate":179,"truncated":null,"has_kudoed":false},{"id":276967283,"resource_state":2,"external_id":"garmin_push_733737474","upload_id":312925633,"athlete":{"id":6565991,"resource_state":1},"name":"03/26/2015 Finland","distance":6224.5,"moving_time":1106,"elapsed_time":1217,"total_elevation_gain":34,"type":"Ride","start_date":"2015-03-26T18:06:07Z","start_date_local":"2015-03-26T20:06:07Z","timezone":"(GMT+02:00) Europe/Helsinki","start_latlng":[61.5,23.77],"end_latlng":[61.47,23.73],"location_city":null,"location_state":null,"location_country":"Finland","start_latitude":61.5,"start_longitude":23.77,"achievement_count":0,"kudos_count":0,"comment_count":0,"athlete_count":1,"photo_count":0,"map":{"id":"a276967283","summary_polyline":"_ikvJ_obpCt@yBhQmClArFhSiAh@oR|VqDd@gMzAi@nCl@bFnKfjAhd@xHlNyAjR`KhRtE`^hNva@hDxR{BdvCyAWJmC","resource_state":2},"trainer":false,"commute":false,"manual":false,"private":false,"flagged":false,"gear_id":null,"average_speed":5.628,"max_speed":9.6,"average_temp":1,"average_watts":85.4,"kilojoules":94.4,"device_watts":false,"truncated":null,"has_kudoed":false},{"id":276967276,"resource_state":2,"external_id":"garmin_push_733737442","upload_id":312925614,"athlete":{"id":6565991,"resource_state":1},"name":"03/26/2015 Finland","distance":9.2,"moving_time":0,"elapsed_time":4447,"total_elevation_gain":4,"type":"Ride","start_date":"2015-03-26T16:20:05Z","start_date_local":"2015-03-26T18:20:05Z","timezone":"(GMT+02:00) Europe/Helsinki","start_latlng":[61.5,23.77],"end_latlng":[61.5,23.77],"location_city":null,"location_state":null,"location_country":"Finland","start_latitude":61.5,"start_longitude":23.77,"achievement_count":0,"kudos_count":0,"comment_count":0,"athlete_count":2,"photo_count":0,"map":{"id":"a276967276","summary_polyline":"_mkvJqnbpCEK","resource_state":2},"trainer":false,"commute":false,"manual":false,"private":false,"flagged":false,"gear_id":null,"average_speed":0,"max_speed":0,"average_temp":0,"average_watts":0,"kilojoules":0,"device_watts":false,"average_heartrate":0,"max_heartrate":192,"truncated":null,"has_kudoed":false},{"id":276967264,"resource_state":2,"external_id":"garmin_push_733737407","upload_id":312925591,"athlete":{"id":6565991,"resource_state":1},"name":"03/26/2015 Finland","distance":8266,"moving_time":1387,"elapsed_time":2811,"total_elevation_gain":68,"type":"Ride","start_date":"2015-03-26T15:08:00Z","start_date_local":"2015-03-26T17:08:00Z","timezone":"(GMT+02:00) Europe/Helsinki","start_latlng":[61.47,23.76],"end_latlng":[61.5,23.77],"location_city":null,"location_state":null,"location_country":"Finland","start_latitude":61.47,"start_longitude":23.76,"achievement_count":0,"kudos_count":0,"comment_count":0,"athlete_count":1,"photo_count":0,"map":{"id":"a276967264","summary_polyline":"ecdvJce_pCjD|RwZd\\}CjgByF|^hAx@mARfDy`@tAsD|A{gBgDgT{Mq`@mF_`@eKgRzAoRyHqNejAad@aFgKiDo@}@r@_@`MuWdEU~RqSf@q@wF{SjBFjD","resource_state":2},"trainer":false,"commute":false,"manual":false,"private":false,"flagged":false,"gear_id":null,"average_speed":5.96,"max_speed":9.7,"average_temp":2,"average_watts":110.1,"kilojoules":152.8,"device_watts":false,"truncated":null,"has_kudoed":false},{"id":275829261,"resource_state":2,"external_id":"garmin_push_731818808","upload_id":311613337,"athlete":{"id":6565991,"resource_state":1},"name":"03/26/2015 Finland","distance":2042.4,"moving_time":376,"elapsed_time":376,"total_elevation_gain":18,"type":"Ride","start_date":"2015-03-26T05:41:47Z","start_date_local":"2015-03-26T07:41:47Z","timezone":"(GMT+02:00) Europe/Helsinki","start_latlng":[61.47,23.73],"end_latlng":[61.47,23.76],"location_city":null,"location_state":null,"location_country":"Finland","start_latitude":61.47,"start_longitude":23.73,"achievement_count":0,"kudos_count":0,"comment_count":0,"athlete_count":1,"photo_count":0,"map":{"id":"a275829261","summary_polyline":"wbevJqgyoCaBsBnFq`@bDwfBhDwAxT_YqDyQ","resource_state":2},"trainer":false,"commute":false,"manual":false,"private":false,"flagged":false,"gear_id":null,"average_speed":5.432,"max_speed":7,"average_temp":7,"average_watts":95.1,"kilojoules":35.8,"device_watts":false,"truncated":null,"has_kudoed":false},{"id":275829242,"resource_state":2,"external_id":"garmin_push_731818773","upload_id":311613307,"athlete":{"id":6565991,"resource_state":1},"name":"03/25/2015 Finland","distance":657,"moving_time":134,"elapsed_time":134,"total_elevation_gain":193,"type":"Ride","start_date":"2015-03-25T18:05:47Z","start_date_local":"2015-03-25T20:05:47Z","timezone":"(GMT+02:00) Europe/Helsinki","start_latlng":[61.47,23.72],"end_latlng":[61.47,23.73],"location_city":null,"location_state":null,"location_country":"Finland","start_latitude":61.47,"start_longitude":23.72,"achievement_count":0,"kudos_count":0,"comment_count":0,"athlete_count":1,"photo_count":0,"map":{"id":"a275829242","summary_polyline":"k|dvJ_{woCuBu]cHoDtAmKbCv@","resource_state":2},"trainer":false,"commute":false,"manual":false,"private":false,"flagged":false,"gear_id":null,"average_speed":4.903,"max_speed":8,"average_temp":-5,"average_watts":66,"kilojoules":8.8,"device_watts":false,"average_heartrate":98.2,"max_heartrate":111,"truncated":null,"has_kudoed":false},{"id":273750055,"resource_state":2,"external_id":"garmin_push_728571334","upload_id":309314099,"athlete":{"id":6565991,"resource_state":1},"name":"03/25/2015 Finland","distance":21968.1,"moving_time":3478,"elapsed_time":3494,"total_elevation_gain":163,"type":"Ride","start_date":"2015-03-25T05:41:38Z","start_date_local":"2015-03-25T07:41:38Z","timezone":"(GMT+02:00) Europe/Helsinki","start_latlng":[61.47,23.73],"end_latlng":[61.5,23.76],"location_city":null,"location_state":null,"location_country":"Finland","start_latitude":61.47,"start_longitude":23.73,"achievement_count":1,"kudos_count":0,"comment_count":0,"athlete_count":1,"photo_count":0,"map":{"id":"a273750055","summary_polyline":"ebevJqgyoCtAxG\\vWpAvJ]z[rAbCZ|RoCdkBnLdhBs@x|@dLlcB}@nnAfA`l@oDz}@h@pr@fAdTdDhR_C`IiA|PiDdKaL~ONzHkg@bp@qLnHwb@fHoBtFeBjVwH`OaRug@_K{~@{KvJaGpAe^MaGnDcNhUsCwcCc@iaCgA_K`EeMhCqe@yG}_AcDuEoLuaAjAuMmFskAVkt@dFg^rEak@vAul@lHqw@rNyk@pOq[dCiPFcf@xEstAcAkGw@cj@_B@","resource_state":2},"trainer":false,"commute":false,"manual":false,"private":false,"flagged":false,"gear_id":null,"average_speed":6.316,"max_speed":9.6,"average_temp":-4,"average_watts":100.5,"kilojoules":349.7,"device_watts":false,"average_heartrate":123.4,"max_heartrate":172,"truncated":null,"has_kudoed":false},{"id":273750032,"resource_state":2,"external_id":"garmin_push_728571315","upload_id":309314072,"athlete":{"id":6565991,"resource_state":1},"name":"03/24/2015 Finland","distance":2.9,"moving_time":0,"elapsed_time":3200,"total_elevation_gain":3,"type":"Ride","start_date":"2015-03-24T15:00:45Z","start_date_local":"2015-03-24T17:00:45Z","timezone":"(GMT+02:00) Europe/Helsinki","start_latlng":[61.5,23.77],"end_latlng":[61.5,23.77],"location_city":null,"location_state":null,"location_country":"Finland","start_latitude":61.5,"start_longitude":23.77,"achievement_count":0,"kudos_count":0,"comment_count":0,"athlete_count":1,"photo_count":0,"map":{"id":"a273750032","summary_polyline":"imkvJgobpCBL","resource_state":2},"trainer":false,"commute":false,"manual":false,"private":false,"flagged":false,"gear_id":null,"average_speed":0,"max_speed":0,"average_temp":0,"average_watts":0,"kilojoules":0,"device_watts":false,"average_heartrate":0,"max_heartrate":189,"truncated":null,"has_kudoed":false},{"id":273750007,"resource_state":2,"external_id":"garmin_push_728571307","upload_id":309314052,"athlete":{"id":6565991,"resource_state":1},"name":"03/24/2015 Finland","distance":8266.2,"moving_time":1350,"elapsed_time":1857,"total_elevation_gain":63,"type":"Ride","start_date":"2015-03-24T14:12:19Z","start_date_local":"2015-03-24T16:12:19Z","timezone":"(GMT+02:00) Europe/Helsinki","start_latlng":[61.47,23.76],"end_latlng":[61.5,23.77],"location_city":null,"location_state":null,"location_country":"Finland","start_latitude":61.47,"start_longitude":23.76,"achievement_count":0,"kudos_count":0,"comment_count":0,"athlete_count":1,"photo_count":0,"map":{"id":"a273750007","summary_polyline":"wadvJ_c_pCdCjOk[j]mBb}AeHxh@fAx@{@]|Fmd@nBg{Ag@sNkDkRkMg_@qF_`@eKwRbBeRsHgNqjAgd@{EgKoDs@aA^a@~M}VpDYdSqTb@q@uF{RpB@|C","resource_state":2},"trainer":false,"commute":false,"manual":false,"private":false,"flagged":false,"gear_id":null,"average_speed":6.123,"max_speed":9.2,"average_temp":4,"average_watts":112.9,"kilojoules":152.4,"device_watts":false,"truncated":null,"has_kudoed":false},{"id":273750001,"resource_state":2,"external_id":"garmin_push_728571298","upload_id":309314038,"athlete":{"id":6565991,"resource_state":1},"name":"03/24/2015 Finland","distance":1811.2,"moving_time":279,"elapsed_time":311,"total_elevation_gain":17,"type":"Ride","start_date":"2015-03-24T05:48:05Z","start_date_local":"2015-03-24T07:48:05Z","timezone":"(GMT+02:00) Europe/Helsinki","start_latlng":[61.47,23.73],"end_latlng":[61.47,23.76],"location_city":null,"location_state":null,"location_country":"Finland","start_latitude":61.47,"start_longitude":23.73,"achievement_count":0,"kudos_count":0,"comment_count":0,"athlete_count":1,"photo_count":0,"map":{"id":"a273750001","summary_polyline":"{bevJ{|yoCrCcRtCecBnD{AfUsYsD_Q","resource_state":2},"trainer":false,"commute":false,"manual":false,"private":false,"flagged":false,"gear_id":null,"average_speed":6.492,"max_speed":9.1,"average_temp":6,"average_watts":120,"kilojoules":33.5,"device_watts":false,"truncated":null,"has_kudoed":false},{"id":272929351,"resource_state":2,"external_id":"garmin_push_727345723","upload_id":308408494,"athlete":{"id":6565991,"resource_state":1},"name":"03/23/2015 Finland","distance":18790.6,"moving_time":3258,"elapsed_time":3451,"total_elevation_gain":118,"type":"Ride","start_date":"2015-03-23T15:16:59Z","start_date_local":"2015-03-23T17:16:59Z","timezone":"(GMT+02:00) Europe/Helsinki","start_latlng":[61.47,23.76],"end_latlng":[61.47,23.73],"location_city":null,"location_state":null,"location_country":"Finland","start_latitude":61.47,"start_longitude":23.76,"achievement_count":0,"kudos_count":0,"comment_count":0,"athlete_count":1,"photo_count":0,"map":{"id":"a272929351","summary_polyline":"acdvJ_c_pCvA|@oB{GQiHnApBm_@gXaPeC_OsWbB_QrFc~B~K{`@rAcP{EegAPa~@qDeTcDiC@eI|Eg`@`@_XlFy[ZaVpDoPkAgKt@uKlNo`@w@yDFsT|AmHhEwGhJkDBaCuHcSjOw^~AiFzBdLwB}K~ByNbBbCe@l\\lDlNnDhGrHoBd@z\\lJhbA{Ade@wl@tZ\\tE{G`IcHp\\qJdCFvJmDzVqOp\\zCjTS||@xExfAyA~OqH|ScC|Q]pe@aFbnAj@zBcB`OnKdSzEf`@~Mj`@lDdTwA|gB}Fhd@zBjA","resource_state":2},"trainer":false,"commute":false,"manual":false,"private":false,"flagged":false,"gear_id":null,"average_speed":5.768,"max_speed":10.8,"average_temp":0,"average_watts":90.1,"kilojoules":293.6,"device_watts":false,"truncated":null,"has_kudoed":false},{"id":272929327,"resource_state":2,"external_id":"garmin_push_727345681","upload_id":308408463,"athlete":{"id":6565991,"resource_state":1},"name":"03/23/2015 Finland","distance":13813.7,"moving_time":3214,"elapsed_time":3352,"total_elevation_gain":164,"type":"Ride","start_date":"2015-03-23T05:45:27Z","start_date_local":"2015-03-23T07:45:27Z","timezone":"(GMT+02:00) Europe/Helsinki","start_latlng":[61.47,23.73],"end_latlng":[61.47,23.76],"location_city":null,"location_state":null,"location_country":"Finland","start_latitude":61.47,"start_longitude":23.73,"achievement_count":0,"kudos_count":0,"comment_count":0,"athlete_count":1,"photo_count":0,"map":{"id":"a272929327","summary_polyline":"gbevJkhyoCvBvAJyLfORvCiH`IyFQsl@rIKl@g\\dOvAjCoHjCFDkF`Dg@pCsE~FrDuEeX~C{OrF_Fd@mCbEyx@u@_x@h@k^_AeKgO{U_Ggb@aReP}Fa\\oDw@rEqD~@oRUiGyBaFb@gS~IgQq@uJfHk^cAqMoR}QsIfEoEvH_LfX_D`TwV_FBx`@tDvy@cAhKyKh_@gHv}Bn@xAkBbP|NhWfPvClY`SbRjXgGhGoE}O","resource_state":2},"trainer":false,"commute":false,"manual":false,"private":false,"flagged":false,"gear_id":null,"average_speed":4.298,"max_speed":10.6,"average_temp":0,"average_watts":79.8,"kilojoules":256.5,"device_watts":false,"truncated":null,"has_kudoed":false},{"id":272929304,"resource_state":2,"external_id":"garmin_push_727345648","upload_id":308408439,"athlete":{"id":6565991,"resource_state":1},"name":"03/22/2015 Finland","distance":9082.9,"moving_time":1729,"elapsed_time":1781,"total_elevation_gain":52,"type":"Ride","start_date":"2015-03-22T18:02:24Z","start_date_local":"2015-03-22T20:02:24Z","timezone":"(GMT+02:00) Europe/Helsinki","start_latlng":[61.51,23.84],"end_latlng":[61.47,23.73],"location_city":null,"location_state":null,"location_country":"Finland","start_latitude":61.51,"start_longitude":23.84,"achievement_count":0,"kudos_count":0,"comment_count":0,"athlete_count":1,"photo_count":0,"map":{"id":"a272929304","summary_polyline":"ojlvJc}opCKqApMcFjDrAmA~~@bTt_DzAlf@tMhlAbCvIn\\xf@`SvAtFzKlsAfi@TnJ_B|P~JxRnFp_@`Nfa@fDvS_BhhByFlb@vBxA","resource_state":2},"trainer":false,"commute":false,"manual":false,"private":false,"flagged":false,"gear_id":null,"average_speed":5.253,"max_speed":8.9,"average_temp":-1,"average_watts":79.4,"kilojoules":137.2,"device_watts":false,"average_heartrate":115.7,"max_heartrate":156,"truncated":null,"has_kudoed":false},{"id":272929285,"resource_state":2,"external_id":"garmin_push_727345610","upload_id":308408417,"athlete":{"id":6565991,"resource_state":1},"name":"03/22/2015 Finland","distance":16340.9,"moving_time":3184,"elapsed_time":3466,"total_elevation_gain":206,"type":"Ride","start_date":"2015-03-22T15:16:27Z","start_date_local":"2015-03-22T17:16:27Z","timezone":"(GMT+02:00) Europe/Helsinki","start_latlng":[61.47,23.73],"end_latlng":[61.51,23.84],"location_city":null,"location_state":null,"location_country":"Finland","start_latitude":61.47,"start_longitude":23.73,"achievement_count":0,"kudos_count":0,"comment_count":0,"athlete_count":1,"photo_count":0,"map":{"id":"a272929285","summary_polyline":"geevJ_jyoCtDlANmLnVdAvDyDbB}IYkm@nI?r@q\\`OtA~C{HfCIImElCOdDkFdGpDqE_YfD}NzFeHtEy{@MiwAeAwJwNqTmGad@oD}@cMuMsFw\\eDUrEeEjAoR[}FyBgEd@wTvIqPq@oJnHe^iAcNuQsQ~CgFiByHqAo[pEaT}GyZgB{P`CuIfEeEUmFqDePuFlDgJym@wc@dj@iEReq@kUyGpNyBlAMmXyAyFqLgJcJHqI_HqC_D}F}Q_FzAgQyDsV}NqBxFStM{EwD{GJo@pX_JddAmDu@mGlEwGkB","resource_state":2},"trainer":false,"commute":false,"manual":false,"private":false,"flagged":false,"gear_id":null,"average_speed":5.132,"max_speed":12.4,"average_temp":0,"average_watts":110,"kilojoules":350.3,"device_watts":false,"average_heartrate":127.8,"max_heartrate":171,"truncated":null,"has_kudoed":false},{"id":271664954,"resource_state":2,"external_id":"garmin_push_725198475","upload_id":306958012,"athlete":{"id":6565991,"resource_state":1},"name":"03/21/2015 Finland","distance":136199,"moving_time":18702,"elapsed_time":20027,"total_elevation_gain":1532,"type":"Ride","start_date":"2015-03-21T07:08:52Z","start_date_local":"2015-03-21T09:08:52Z","timezone":"(GMT+02:00) Europe/Helsinki","start_latlng":[61.47,23.73],"end_latlng":[61.47,23.73],"location_city":null,"location_state":null,"location_country":"Finland","start_latitude":61.47,"start_longitude":23.73,"achievement_count":2,"kudos_count":0,"comment_count":0,"athlete_count":1,"photo_count":0,"map":{"id":"a271664954","summary_polyline":"_eevJihyoCpJp`BmC|oB|WjgGkDxvDxGb~AyVdbAex@pz@e]fEU{J}WmEkHa^aNgEy_AxX}jA{g@_bBs@wf@oi@sm@b]qOzh@we@g\\kgAzJe]kQie@ehAoaBgr@wwCdgAylAin@yRxIwLbo@ur@xgAcPdm@y}BlpCiW_cCzK}v@oq@{hBnBed@uMaaAk`@wjAjUewAbRzA|Cw|AwCn{AaRw@}RbtAa[`Ie]}mAb]hnAgmAloD`Dxl@yLpd@oC`gAqNlToLoAkEfRzFbpDucAjIan@~t@sSniA_aBhxB}I~|@bU`eF|p@biBlYdUrD|_@dd@uDbb@pT|q@vhG`@pgB`ZdnArf@ncAJdy@hOt\\zS|wApE~FjQs[vxAobEz|@hwJuEppEbJdcA}GzbDjk@j|Afd@pVfv@_p@zn@ti@gGsfBhDgPxdBo\\nd@pN|d@_k@tUam@rCtqC`a@|kDuDnz@pXdCdUa\\pt@tDdQqhA|\\cr@lMmCr\\ywAtnB{mD~l@}a@zSu{@nd@ea@~uA}Eh[vk@zq@cRvc@zXdzA`TfZ{eBv`@_mEcBmuGzKeiDfc@uzCdDorDuFsmAax@yzFy[c]mZi|Am\\ee@iLwvA{MiVn@uzAmb@_xCsM}HcEigBxUc[zr@eMnN`FvG`]tWfEl@hKr_@yEzu@qz@pPcf@`EqZyG}{AdD}xD}WcjGpCcmBwG{`B","resource_state":2},"trainer":false,"commute":false,"manual":false,"private":false,"flagged":false,"gear_id":null,"average_speed":7.283,"max_speed":15.5,"average_temp":-3,"average_watts":161.3,"kilojoules":3016.2,"device_watts":false,"average_heartrate":141.8,"max_heartrate":181,"truncated":null,"has_kudoed":false},{"id":270863426,"resource_state":2,"external_id":"garmin_push_723943933","upload_id":306063116,"athlete":{"id":6565991,"resource_state":1},"name":"03/19/2015 Finland","distance":20673.1,"moving_time":5479,"elapsed_time":6139,"total_elevation_gain":272,"type":"Ride","start_date":"2015-03-19T15:04:32Z","start_date_local":"2015-03-19T17:04:32Z","timezone":"(GMT+02:00) Europe/Helsinki","start_latlng":[61.47,23.76],"end_latlng":[61.47,23.73],"location_city":null,"location_state":null,"location_country":"Finland","start_latitude":61.47,"start_longitude":23.76,"achievement_count":0,"kudos_count":0,"comment_count":0,"athlete_count":1,"photo_count":0,"map":{"id":"a270863426","summary_polyline":"}bdvJ}d_pC~DlQ`IqFxCtH^vFfBFnM|^^bJ|BCjEwFpEtENeDqDmLWeGbD_OlFuFv@_FfEscAoAmj@h@m^}@gJqNqTcHae@yQiO}Fc\\sDw@vEoDdA}QOgG}BqF^sSzI_Qc@_K`Hu]cAeMhH{LdBmt@wAeT{B_DCgVyDcb@w@yD_MhIDaHvG{G|AaHeCoNCmTwDaMfHn@`@kFgBmPb@}TwFi\\YsPeBoKCaQBhShFlP`CjC`BiCzDf@n@v]dJbaASvX{AzLeZdNPnGaEtDmB|H{E`CyGfVuAtQd@x^tAnVnEjT}Ot]oDbUsVyE?n_@zDfz@kAlL{IjWoAnJw@zk@yEtlAj@tAeBdPrNhWrDp]hLz\\hEdV}BpjB}Fra@zBjA","resource_state":2},"trainer":false,"commute":false,"manual":false,"private":false,"flagged":false,"gear_id":null,"average_speed":3.773,"max_speed":11.1,"average_temp":4,"average_watts":75.7,"kilojoules":414.5,"device_watts":false,"truncated":null,"has_kudoed":false},{"id":270863369,"resource_state":2,"external_id":"garmin_push_723943881","upload_id":306063059,"athlete":{"id":6565991,"resource_state":1},"name":"03/19/2015 Finland","distance":16568.7,"moving_time":3339,"elapsed_time":3519,"total_elevation_gain":193,"type":"Ride","start_date":"2015-03-19T05:41:47Z","start_date_local":"2015-03-19T07:41:47Z","timezone":"(GMT+02:00) Europe/Helsinki","start_latlng":[61.47,23.73],"end_latlng":[61.47,23.76],"location_city":null,"location_state":null,"location_country":"Finland","start_latitude":61.47,"start_longitude":23.73,"achievement_count":0,"kudos_count":0,"comment_count":0,"athlete_count":1,"photo_count":0,"map":{"id":"a270863369","summary_polyline":"}bevJ{gyoCiBaCdAgGz[v@rDaEbBiHa@wn@vIQ`@y[|OjA~BoHrCOE_FlBLnE_GjFnEByDiEaS~C}OtFqFrB}RbCkx@oAmh@n@e]eAgL_OyUcGqb@kRaPoFc\\uDgAxEaD~@sROyFcCwGf@gR`JkQq@eJbHk]aAqMdHcNp@aSb@gi@uAiKoBeCEiTeFki@sO~IaEjLmEjBiIt[o@tRbA|b@|Ffb@aP`^eDjTqVkFAf^xDj|@mAtLsIxVaBtNc@`g@gDvn@Ida@cBxOzNdWhPtCbW~PjHxGnKlQgH|GaE{P","resource_state":2},"trainer":false,"commute":false,"manual":false,"private":false,"flagged":false,"gear_id":null,"average_speed":4.962,"max_speed":11.7,"average_temp":0,"average_watts":98.6,"kilojoules":329.2,"device_watts":false,"truncated":null,"has_kudoed":false},{"id":270298928,"resource_state":2,"external_id":"garmin_push_723076351","upload_id":305439689,"athlete":{"id":6565991,"resource_state":1},"name":"03/18/2015 Finland","distance":25752,"moving_time":5213,"elapsed_time":5320,"total_elevation_gain":213,"type":"Ride","start_date":"2015-03-18T15:24:32Z","start_date_local":"2015-03-18T17:24:32Z","timezone":"(GMT+02:00) Europe/Helsinki","start_latlng":[61.5,23.76],"end_latlng":[61.47,23.73],"location_city":null,"location_state":null,"location_country":"Finland","start_latitude":61.5,"start_longitude":23.76,"achievement_count":0,"kudos_count":0,"comment_count":0,"athlete_count":1,"photo_count":0,"map":{"id":"a270298928","summary_polyline":"kjjvJab_pCrQuD@}K|LyClGpKbCy@hAkFbAoeAtKnFzE`JbDpMbExDtQ_IrSrDvKuAhCkYbFmoAx@cm@hBoLvHoTtAkQ{EieAt@kd@s@m]gEaRyNcNx@}ZeAcQvWe\\dBaI^mVjD_PmA{Jv@mKlNe`@_AkG^eUbGwM~JiF}HwUlPu`@hEiS~BkbAfNtDbGcGfIcAlFwHxSvBbAlGi@r_AfJpt@qC|FpJ~s@qHpKvDpZ}TbQaYvGmA~L{YrM^bG}EjFwBrI`DlVtLta@tJMdEdJo@zl@mH~Mt@~MmHd_@x@zH_JlQy@jTtCbIUpNe@xGmEdDpDvAzF|[fL~LnDdAzGrd@bO~UxA|pA}Bxw@mB|T}DbEa@fRqCuDaAnCrEvXqFaEcDdFwCl@HrEkCWwBxHgPiAo@h\\qIRT`l@_IzFwChHuPA{AdH","resource_state":2},"trainer":false,"commute":false,"manual":false,"private":false,"flagged":false,"gear_id":null,"average_speed":4.94,"max_speed":11.2,"average_temp":5,"average_watts":83.5,"kilojoules":435,"device_watts":false,"truncated":null,"has_kudoed":false},{"id":270298836,"resource_state":2,"external_id":"garmin_push_723076263","upload_id":305439627,"athlete":{"id":6565991,"resource_state":1},"name":"03/18/2015 Finland","distance":18058.9,"moving_time":3557,"elapsed_time":3701,"total_elevation_gain":190,"type":"Ride","start_date":"2015-03-18T05:39:27Z","start_date_local":"2015-03-18T07:39:27Z","timezone":"(GMT+02:00) Europe/Helsinki","start_latlng":[61.47,23.73],"end_latlng":[61.5,23.76],"location_city":null,"location_state":null,"location_country":"Finland","start_latitude":61.47,"start_longitude":23.73,"achievement_count":0,"kudos_count":0,"comment_count":0,"athlete_count":1,"photo_count":0,"map":{"id":"a270298836","summary_polyline":"uaevJaiyoCGtAxATt@sMhUx@pD{D`BaJ_@em@vIQp@g\\dOxAbCqHjCL@wFzB?vDiFfG`D{DwOYyG~CcOrG{IbEkx@u@{y@h@}[y@qKyNuU_H}d@eDm@wLmMqF{[yDgA~EmD|@_RGyFgC}F`@wSbJaQy@yIjHi^_AyMhH_Mt@aTZ}h@qA_KuD}Cx@T@gTaFci@wOtIaDbKoFtC_IpZw@|Tr@j\\`AfPjE`VqOj]mD~TwViFAz_@|Ddx@kAtNyKb_@wGjyBgDta@{e@sBuDtFiFf@kE_EuCsLqFeJ{JwFPvRgBvQFf`@_AjE}B~@{GmKmM|EDbKaTvG","resource_state":2},"trainer":false,"commute":false,"manual":false,"private":false,"flagged":false,"gear_id":null,"average_speed":5.077,"max_speed":11.5,"average_temp":-1,"average_watts":101.2,"kilojoules":360.1,"device_watts":false,"truncated":null,"has_kudoed":false},{"id":269685527,"resource_state":2,"external_id":"garmin_push_722150849","upload_id":304756814,"athlete":{"id":6565991,"resource_state":1},"name":"03/17/2015 Finland","distance":5751.2,"moving_time":1035,"elapsed_time":1035,"total_elevation_gain":32,"type":"Ride","start_date":"2015-03-17T16:40:46Z","start_date_local":"2015-03-17T18:40:46Z","timezone":"(GMT+02:00) Europe/Helsinki","start_latlng":[61.5,23.77],"end_latlng":[61.47,23.73],"location_city":null,"location_state":null,"location_country":"Finland","start_latitude":61.5,"start_longitude":23.77,"achievement_count":0,"kudos_count":0,"comment_count":0,"athlete_count":1,"photo_count":0,"map":{"id":"a269685527","summary_polyline":"apjvJ{obpC`Q{@p@iRvVeEZmMxA]lCd@lFrKzrAlh@`@hJuApRpMjQ~Gzk@vHjRlEzV}AtiB{Fbb@xBfA","resource_state":2},"trainer":false,"commute":false,"manual":false,"private":false,"flagged":false,"gear_id":null,"average_speed":5.557,"max_speed":9.8,"average_temp":5,"average_watts":82.4,"kilojoules":85.2,"device_watts":false,"average_heartrate":66.6,"max_heartrate":72,"truncated":null,"has_kudoed":false},{"id":269661214,"resource_state":2,"external_id":"garmin_push_722116963","upload_id":304730218,"athlete":{"id":6565991,"resource_state":1},"name":"03/17/2015 Finland","distance":5.1,"moving_time":0,"elapsed_time":4271,"total_elevation_gain":4,"type":"Ride","start_date":"2015-03-17T14:56:07Z","start_date_local":"2015-03-17T16:56:07Z","timezone":"(GMT+02:00) Europe/Helsinki","start_latlng":[61.5,23.77],"end_latlng":[61.5,23.77],"location_city":null,"location_state":null,"location_country":"Finland","start_latitude":61.5,"start_longitude":23.77,"achievement_count":0,"kudos_count":0,"comment_count":0,"athlete_count":1,"photo_count":0,"map":{"id":"a269661214","summary_polyline":"emkvJ{mbpCBi@","resource_state":2},"trainer":false,"commute":false,"manual":false,"private":false,"flagged":false,"gear_id":null,"average_speed":0,"max_speed":0,"average_temp":0,"average_watts":0,"kilojoules":0,"device_watts":false,"average_heartrate":0,"max_heartrate":186,"truncated":null,"has_kudoed":false},{"id":269660653,"resource_state":2,"external_id":"garmin_push_722115796","upload_id":304729591,"athlete":{"id":6565991,"resource_state":1},"name":"03/17/2015 Finland","distance":8359.8,"moving_time":1252,"elapsed_time":1633,"total_elevation_gain":73,"type":"Ride","start_date":"2015-03-17T14:14:32Z","start_date_local":"2015-03-17T16:14:32Z","timezone":"(GMT+02:00) Europe/Helsinki","start_latlng":[61.47,23.76],"end_latlng":[61.5,23.77],"location_city":null,"location_state":null,"location_country":"Finland","start_latitude":61.47,"start_longitude":23.76,"achievement_count":0,"kudos_count":0,"comment_count":0,"athlete_count":1,"photo_count":0,"map":{"id":"a269660653","summary_polyline":"abdvJad_pCpCrOq[z^uAz^sA`nBqBLLyAaCcDnDe^tA}CnAwjBcDeRaN_a@aF{^cKmR~AkRsHoNwhAgc@uGmLwCm@oA`@g@nM{IbEwL@KtR}Sz@m@oFcAOy@hCePa@PzC","resource_state":2},"trainer":false,"commute":false,"manual":false,"private":false,"flagged":false,"gear_id":null,"average_speed":6.677,"max_speed":11.4,"average_temp":11,"average_watts":142.3,"kilojoules":178.1,"device_watts":false,"truncated":null,"has_kudoed":false},{"id":269660614,"resource_state":2,"external_id":"garmin_push_722115723","upload_id":304729527,"athlete":{"id":6565991,"resource_state":1},"name":"03/17/2015 Finland","distance":2094.9,"moving_time":377,"elapsed_time":474,"total_elevation_gain":19,"type":"Ride","start_date":"2015-03-17T05:41:24Z","start_date_local":"2015-03-17T07:41:24Z","timezone":"(GMT+02:00) Europe/Helsinki","start_latlng":[61.47,23.73],"end_latlng":[61.47,23.76],"location_city":null,"location_state":null,"location_country":"Finland","start_latitude":61.47,"start_longitude":23.73,"achievement_count":0,"kudos_count":0,"comment_count":0,"athlete_count":1,"photo_count":0,"map":{"id":"a269660614","summary_polyline":"}aevJiiyoCuB}AlFi`@t@gaA`Bub@f[k]iE_Q","resource_state":2},"trainer":false,"commute":false,"manual":false,"private":false,"flagged":false,"gear_id":null,"average_speed":5.557,"max_speed":7.7,"average_temp":10,"average_watts":100.4,"kilojoules":37.9,"device_watts":false,"truncated":null,"has_kudoed":false},{"id":269660536,"resource_state":2,"external_id":"garmin_push_722115680","upload_id":304729476,"athlete":{"id":6565991,"resource_state":1},"name":"03/16/2015 Finland","distance":20442.2,"moving_time":4933,"elapsed_time":5500,"total_elevation_gain":289,"type":"Ride","start_date":"2015-03-16T15:19:53Z","start_date_local":"2015-03-16T17:19:53Z","timezone":"(GMT+02:00) Europe/Helsinki","start_latlng":[61.47,23.76],"end_latlng":[61.47,23.73],"location_city":null,"location_state":null,"location_country":"Finland","start_latitude":61.47,"start_longitude":23.76,"achievement_count":0,"kudos_count":0,"comment_count":0,"athlete_count":1,"photo_count":0,"map":{"id":"a269660536","summary_polyline":"cbdvJmc_pC~DzN|HaElD~OrB`@~Lv^ZxI|Cm@rCqEfFrEVcDwEaThDcPlGwInEy|@_Aat@l@{\\cAyLaOuU{Ggd@kDy@sLiMaFq[yDeBpEgCf@_G`@gPqCmI^cSlJcTqAsB{JpE{FgV~CfBlNeIpFmNLiLjG}Jz@wSTms@eJsIc@i^sG}@nAsUrCgBjFdg@GbVfC~CzAvRyB|eATbCdAYBtw@qAxBsDy@eDnOiDpEmA_TsD~CuAnWtCtH[|OYnFuEfEhDdAbGl\\nLfMdDz@zFlb@vOfW|@tKg@t^fAbg@eDds@h@~AoBxTwDjDo@`SoC_E}@dDtE~WcFgEmFtG}A[QoIwKu[cD_CiE}PaIhG_EqPbC|KiAtGaWtYsCfdBkB|GyFeGgD`AcIx]dDfGlHbDvBkKdCt@","resource_state":2},"trainer":false,"commute":false,"manual":false,"private":false,"flagged":false,"gear_id":null,"average_speed":4.144,"max_speed":12.1,"average_temp":4,"average_watts":91.5,"kilojoules":451.1,"device_watts":false,"truncated":null,"has_kudoed":false},{"id":269660521,"resource_state":2,"external_id":"garmin_push_722115637","upload_id":304729427,"athlete":{"id":6565991,"resource_state":1},"name":"03/16/2015 Finland","distance":16612.2,"moving_time":3472,"elapsed_time":3595,"total_elevation_gain":182,"type":"Ride","start_date":"2015-03-16T05:41:54Z","start_date_local":"2015-03-16T07:41:54Z","timezone":"(GMT+02:00) Europe/Helsinki","start_latlng":[61.47,23.73],"end_latlng":[61.47,23.76],"location_city":null,"location_state":null,"location_country":"Finland","start_latitude":61.47,"start_longitude":23.73,"achievement_count":0,"kudos_count":0,"comment_count":0,"athlete_count":1,"photo_count":0,"map":{"id":"a269660521","summary_polyline":"aaevJulyoCz@yEbW`@hDyDbBsJ_@il@tIGn@q\\xOnAvBmHpCEBkFrBDxDiF|FtDqEiY~C{NzF}FzBeTzBgx@mA_g@l@{\\}@mKkNoTeHoe@kRqOoFa\\sDoAxE{CdAkSM{EiCiFd@sS`JyP{@qJpH{]_AaN`HqL`AmTJqs@{DkE@}SoCc]kEUw@iGuJbG_D`KoFzCyIr_@p@vs@bGb`@}Ot]oDbUyVsE@`^xDn}@sBjNcHhRoBxOa@zh@aDlm@Q`a@{AlOpNlW~P|Cn[`UIjDkIdOfFzTrIoJqDuP","resource_state":2},"trainer":false,"commute":false,"manual":false,"private":false,"flagged":false,"gear_id":null,"average_speed":4.785,"max_speed":12,"average_temp":-2,"average_watts":89.9,"kilojoules":312.1,"device_watts":false,"truncated":null,"has_kudoed":false},{"id":268786707,"resource_state":2,"external_id":"garmin_push_720600185","upload_id":303749152,"athlete":{"id":6565991,"resource_state":1},"name":"03/15/2015 Finland","distance":3130.6,"moving_time":653,"elapsed_time":751,"total_elevation_gain":21,"type":"Ride","start_date":"2015-03-15T16:00:32Z","start_date_local":"2015-03-15T18:00:32Z","timezone":"(GMT+02:00) Europe/Helsinki","start_latlng":[61.47,23.73],"end_latlng":[61.47,23.73],"location_city":null,"location_state":null,"location_country":"Finland","start_latitude":61.47,"start_longitude":23.73,"achievement_count":0,"kudos_count":0,"comment_count":0,"athlete_count":1,"photo_count":0,"map":{"id":"a268786707","summary_polyline":"{devJmiyoCiAHgB~IyMkM`Jk^~Co@zFvEhDcm@UcYtAk[eCd{A}F|`@ZnB","resource_state":2},"trainer":false,"commute":false,"manual":false,"private":false,"flagged":false,"gear_id":null,"average_speed":4.794,"max_speed":8.2,"average_temp":7,"average_watts":67.2,"kilojoules":43.9,"device_watts":false,"truncated":null,"has_kudoed":false},{"id":268486888,"resource_state":2,"external_id":"garmin_push_720169939","upload_id":303407809,"athlete":{"id":6565991,"resource_state":1},"name":"03/15/2015 Finland","distance":53957.1,"moving_time":10869,"elapsed_time":11853,"total_elevation_gain":343,"type":"Ride","start_date":"2015-03-15T08:34:53Z","start_date_local":"2015-03-15T10:34:53Z","timezone":"(GMT+02:00) Europe/Helsinki","start_latlng":[61.5,23.91],"end_latlng":[61.47,23.73],"location_city":null,"location_state":null,"location_country":"Finland","start_latitude":61.5,"start_longitude":23.91,"achievement_count":2,"kudos_count":0,"comment_count":0,"athlete_count":1,"photo_count":0,"map":{"id":"a268486888","summary_polyline":"aujvJ{j|pC{@fZpFrWm@zPhClPmC~OuMuc@gXf}@mJxJ}ApLzCjDs@bn@tCpP_CeBmCtKmd@{Q_IhDgB_KkNyBiAuTqIf@{Dfs@qStLIzZ~EzUcEdHmC~u@vf@r_AhKr`@bBjj@{D`v@vEnl@~ExWvLwBpF~X|Bpf@pEfIfICnGdc@v@tWaFzm@rCzbBfJrt@rNxj@xCro@|G~RhBl\\oAvQcNzRqTjlAePx_C}_@~xDaYtjAmArWxJpoAhMjv@Hjh@hRwNzDzL|SjFdQzW|J~}F~MdIl`@doCKt`BfN`X`JrjA~FaJpYpAlQuVfHQdCmu@}R{vBjBgf@}Cco@~BeOcBy[jNu_AhD_l@`VkJji@ir@cAmO`S{WpDgXoFeh@Keh@qOvLgBsVlBjVjDkEXsT~B_GHdN|DrEvC_gAcA{y@vFo@w@_\\pYjD~Mir@}H}`@wM`EcLuMfDmKaAuIzPum@nUeb@uHyNvEyRyMrDhQyaBwTid@as@jAb@{u@vCiD@}KnCoAb@_PtQgExFbKjJiKlDon@nWqc@xGa_@sVgl@g@kRaHaTkTaf@ge@}a@eRqDxFpg@zMnc@v@pS_DbwAoNtGwHx\\hMjLjCyK|B~@","resource_state":2},"trainer":false,"commute":false,"manual":false,"private":false,"flagged":false,"gear_id":null,"average_speed":4.964,"max_speed":11,"average_temp":3,"average_watts":80.2,"kilojoules":872.1,"device_watts":false,"truncated":null,"has_kudoed":false},{"id":268486788,"resource_state":2,"external_id":"garmin_push_720169839","upload_id":303407742,"athlete":{"id":6565991,"resource_state":1},"name":"03/14/2015 Finland","distance":4341.1,"moving_time":724,"elapsed_time":798,"total_elevation_gain":35,"type":"Ride","start_date":"2015-03-14T18:46:46Z","start_date_local":"2015-03-14T20:46:46Z","timezone":"(GMT+02:00) Europe/Helsinki","start_latlng":[61.51,23.84],"end_latlng":[61.5,23.91],"location_city":null,"location_state":null,"location_country":"Finland","start_latitude":61.51,"start_longitude":23.84,"achievement_count":0,"kudos_count":0,"comment_count":0,"athlete_count":1,"photo_count":0,"map":{"id":"a268486788","summary_polyline":"cllvJi_ppCTpBjCOjFsGnGc@bJicApBwm@zHw]nEq`@tS{q@pBoTlBm[mAgO`@mHyFmDuBmV}DoAi@iPsDyM^aS","resource_state":2},"trainer":false,"commute":false,"manual":false,"private":false,"flagged":false,"gear_id":null,"average_speed":5.996,"max_speed":8,"average_temp":2,"average_watts":113.7,"kilojoules":82.3,"device_watts":false,"truncated":null,"has_kudoed":false},{"id":268486767,"resource_state":2,"external_id":"garmin_push_720169772","upload_id":303407705,"athlete":{"id":6565991,"resource_state":1},"name":"03/14/2015 Finland","distance":16038.8,"moving_time":3575,"elapsed_time":3742,"total_elevation_gain":215,"type":"Ride","start_date":"2015-03-14T15:48:48Z","start_date_local":"2015-03-14T17:48:48Z","timezone":"(GMT+02:00) Europe/Helsinki","start_latlng":[61.47,23.73],"end_latlng":[61.51,23.84],"location_city":null,"location_state":null,"location_country":"Finland","start_latitude":61.47,"start_longitude":23.73,"achievement_count":0,"kudos_count":0,"comment_count":0,"athlete_count":1,"photo_count":0,"map":{"id":"a268486767","summary_polyline":"qqdvJesyoC`JDjGuJa@uq@nIc@d@q[~ObAvBkHpCI@_FjCMfDgFzFtDuEcYhDoNpGoJ`E}y@u@qv@h@yZkAaP_OoUmGic@kDw@qLaMgFs[}DyAhEwClAyQCcGiCkGd@mSzIyPs@aJfHs]{@eNxG_MfAaU\\sg@oAqKwBoCAsTcFeh@eMtHHoF{DuQuFnD}Jsn@_c@vj@}DVcq@sU{BjBmDhKcCdABsWiB_HgLwIsIJmIcGgDsDaGcRsTy@uZiPcBvGQdM}NmDi@dX}I`dA_Em@iHbHmD`@w@iF","resource_state":2},"trainer":false,"commute":false,"manual":false,"private":false,"flagged":false,"gear_id":null,"average_speed":4.486,"max_speed":12.2,"average_temp":0,"average_watts":91.9,"kilojoules":328.4,"device_watts":false,"truncated":null,"has_kudoed":false},{"id":266565112,"resource_state":2,"external_id":"garmin_push_717098183","upload_id":301257028,"athlete":{"id":6565991,"resource_state":1},"name":"03/11/2015 Finland","distance":23249.9,"moving_time":5408,"elapsed_time":5533,"total_elevation_gain":207,"type":"Ride","start_date":"2015-03-11T15:18:15Z","start_date_local":"2015-03-11T17:18:15Z","timezone":"(GMT+02:00) Europe/Helsinki","start_latlng":[61.5,23.76],"end_latlng":[61.47,23.73],"location_city":null,"location_state":null,"location_country":"Finland","start_latitude":61.5,"start_longitude":23.76,"achievement_count":0,"kudos_count":0,"comment_count":0,"athlete_count":1,"photo_count":0,"map":{"id":"a266565112","summary_polyline":"wojvJi}~oCm_@bDwEhMUdH`BhHiCwMuFk^uCa`@iAaj@h@sh@}I{GkLIoEuIqAiMwDcMTyIwFecA~E{JlDqObAsRuA{JwIfEmBuB_J_p@cA}i@tD}ZeBiMlAmNq@_NyF}LsBwQkFmIeMfDUmQ}BuL}CsEmDsPkCqCQeVjCu^r@{DxCyCuEcUUgMhAmHs@_BvAqEhG`@fHmG`Dms@~IkBpApT~L|AdEdIfKb@k@`IzGzMhGz`@eFnOz@fVmBbNKpe@eH`G}Lp\\mDhBxIdEnGlRrDnZDfOmBrFhFhm@_GfxAzHl\\bCdg@|DdIhJTbJ|p@dJiDjn@QhIzStHjKxSzApFtKhsAth@\\nJ{AvQbL|R~Dl^xMv`@xDjVqBr`CiBnK","resource_state":2},"trainer":false,"commute":false,"manual":false,"private":false,"flagged":false,"gear_id":null,"average_speed":4.299,"max_speed":8.6,"average_temp":0,"average_watts":81.1,"kilojoules":438.6,"device_watts":false,"average_heartrate":129,"max_heartrate":172,"truncated":null,"has_kudoed":false},{"id":266346383,"resource_state":2,"external_id":"garmin_push_716762107","upload_id":301012470,"athlete":{"id":6565991,"resource_state":1},"name":"03/11/2015 Finland","distance":17904.5,"moving_time":3415,"elapsed_time":3415,"total_elevation_gain":221,"type":"Ride","start_date":"2015-03-11T05:42:45Z","start_date_local":"2015-03-11T07:42:45Z","timezone":"(GMT+02:00) Europe/Helsinki","start_latlng":[61.47,23.73],"end_latlng":[61.5,23.76],"location_city":null,"location_state":null,"location_country":"Finland","start_latitude":61.47,"start_longitude":23.73,"achievement_count":0,"kudos_count":0,"comment_count":0,"athlete_count":1,"photo_count":0,"map":{"id":"a266346383","summary_polyline":"c_evJahyoCz@oL~TdBhDuDfBmJ_@ql@vI[h@k\\zOrAzBmHrCGCsElCU~CgFhGrDyEyWnDwPjFaF~BoTzBg~@oAab@f@}^}@qI_OqUiGic@qRwOcFs[aE_A|EoDb@qGb@oNiC}HTuSbJsQu@eJjHy^_AuMnHeMp@_SXoi@kAqJyBiCFgUyFuh@_PlJaDdKeFdCuHlY{@xQp@j^|@`QrEnW{Ov]iD~T{VwEHp`@xDdw@uAvNuHlTiBbL_Afo@iJdhBsd@_CcFbGoFd@{D{CmCiLsFaKmKyFwBtkAoCjB}GgK}LzEIpJiTjG","resource_state":2},"trainer":false,"commute":false,"manual":false,"private":false,"flagged":false,"gear_id":null,"average_speed":5.243,"max_speed":9.9,"average_temp":0,"average_watts":110.1,"kilojoules":375.8,"device_watts":false,"average_heartrate":136.4,"max_heartrate":171,"truncated":null,"has_kudoed":false},{"id":266123090,"resource_state":2,"external_id":"garmin_push_716418817","upload_id":300765147,"athlete":{"id":6565991,"resource_state":1},"name":"03/10/2015 Finland","distance":22673.5,"moving_time":5359,"elapsed_time":5512,"total_elevation_gain":210,"type":"Ride","start_date":"2015-03-10T15:32:55Z","start_date_local":"2015-03-10T17:32:55Z","timezone":"(GMT+02:00) Europe/Helsinki","start_latlng":[61.5,23.76],"end_latlng":[61.47,23.73],"location_city":null,"location_state":null,"location_country":"Finland","start_latitude":61.5,"start_longitude":23.76,"achievement_count":0,"kudos_count":0,"comment_count":0,"athlete_count":1,"photo_count":0,"map":{"id":"a266123090","summary_polyline":"wpjvJc~~oCi@rDk]BaExKi@xGbBhIaD_OiG}c@qBu[}@ud@f@}j@cJcHcK`@cFeJwGu\\f@_H{FacA~Js[rAwR}AgLwInEmBmBsIap@g@oj@fCaLf@eNuBoLjAeOe@sMgGkLeCoSoFmH_MpDAoReMec@yC_Ec@gO`D_e@v@qDlBy@`@}DqEyQFk[dAiD~FVhH{GtDyr@tIyAlAvThMbBpB~J|HwClCzBa@zJzG|MvFda@qKfZ}ClBtFeKdBxFeAh_AxDnTjMdFnGu@bIyHjDz@aAf`AvS||CfB`i@xLvhAhC~KnClF`DEEpDfDjH|MpQnS~AxFxK`sAlh@\\nJsAjRvJpRbF~^bMd_@fErU{AnjB{Fr`@~B`B","resource_state":2},"trainer":false,"commute":false,"manual":false,"private":false,"flagged":false,"gear_id":null,"average_speed":4.231,"max_speed":10.3,"average_temp":1,"average_watts":82.6,"kilojoules":442.7,"device_watts":false,"average_heartrate":125,"max_heartrate":161,"truncated":null,"has_kudoed":false},{"id":266123025,"resource_state":2,"external_id":"garmin_push_716418751","upload_id":300765100,"athlete":{"id":6565991,"resource_state":1},"name":"03/10/2015 Finland","distance":18027,"moving_time":3192,"elapsed_time":3251,"total_elevation_gain":204,"type":"Ride","start_date":"2015-03-10T05:27:27Z","start_date_local":"2015-03-10T07:27:27Z","timezone":"(GMT+02:00) Europe/Helsinki","start_latlng":[61.47,23.73],"end_latlng":[61.5,23.76],"location_city":null,"location_state":null,"location_country":"Finland","start_latitude":61.47,"start_longitude":23.73,"achievement_count":0,"kudos_count":0,"comment_count":0,"athlete_count":1,"photo_count":0,"map":{"id":"a266123025","summary_polyline":"gaevJeeyoCnaAuoBrCAAmFzB?lEoFlFjD}EiYfD{NpGsIbE_x@R}ZiA{]r@}WeA_QqNcT{Gce@qD_AcMuM_Fc[}DwAtE}CjAgS[kF}BkEh@iTpIsPo@_JrH}^w@kNhHoMhAq|@qA_K{BoCLmT{Fki@sO`JgDdKqF|CaIx[@hm@bAbRjEfXyOt]aDbTwVyE?|^zD`{@qAxL}Kb`@_A~o@cFbnAkCvYqd@aCeFfGgF^cE}CuCyLqFoJaKyFHhSaB~OBja@y@xDeClAqGoKsMtEF|KkKhAoH|E","resource_state":2},"trainer":false,"commute":false,"manual":false,"private":false,"flagged":false,"gear_id":null,"average_speed":5.648,"max_speed":11.5,"average_temp":0,"average_watts":112.4,"kilojoules":358.8,"device_watts":false,"average_heartrate":143.5,"max_heartrate":179,"truncated":null,"has_kudoed":false},{"id":265572724,"resource_state":2,"external_id":"garmin_push_715544950","upload_id":300158449,"athlete":{"id":6565991,"resource_state":1},"name":"03/09/2015 Finland","distance":22804.5,"moving_time":4729,"elapsed_time":5012,"total_elevation_gain":319,"type":"Ride","start_date":"2015-03-09T15:22:35Z","start_date_local":"2015-03-09T17:22:35Z","timezone":"(GMT+02:00) Europe/Helsinki","start_latlng":[61.5,23.76],"end_latlng":[61.47,23.73],"location_city":null,"location_state":null,"location_country":"Finland","start_latitude":61.5,"start_longitude":23.76,"achievement_count":3,"kudos_count":0,"comment_count":0,"athlete_count":1,"photo_count":0,"map":{"id":"a265572724"